authors,title,source,DNA_RNA,DNA,RNA,year,volume_l,filter_size_µm,filter_type,DNA_extr,loci,16S,18S,23S,28S,ITS2,ITS1,cytb,CO1,NADH4,D-loop,12S,rbcL,rrnA,arrA,cbbL,nifH,aprA,rpoC1,pufM,luxA,amoA,mutS,phnD,LSU rDNA,tufA,genome,transcriptome,water,fresh,marine,system,type_organism,id_type,ASV,OTU,Species,max_OTUs,max_ASV,max_spp,max_spp_other,phylum,continent,region,country
"Pochon, X; Zaiko, A; Fletcher, LM; Laroche, O; Wood, SA",Wanted dead or alive? Using metabarcoding of environmental DNA and RNA to distinguish living assemblages for biosecurity applications,PLOS ONE,DNA,1,0,2017,0.03,>1,Glass_Fiber,ZRMP_Kit,18S,0,1,0,0,0,0,0,0,0,0,0,0,0,0,0,0,0,0,0,0,0,0,0,0,0,0,0,marine,0,1,Bilge water,Non target,OTU,0,1,0,"1,180",NA,NA,NA,NA,Oceania,SOTUhwest Pacific,New Zeland
"Stoeckle, BC; Beggel, S; Cerwenka, AF; Motivans, E; Kuehn, R; Geist, J",A systematic approach to evaluate the influence of environmental conditions on eDNA detection success in aquatic ecosystems,PLOS ONE,DNA,1,0,2017,0.5,0.4_1,Glass_Fiber,QBT_Kit_alt,COI,0,0,0,0,0,0,0,1,0,0,0,0,0,0,0,0,0,0,0,0,0,0,0,0,0,0,0,fresh,1,0,Aquarium,Fish,NA,0,0,0,NA,NA,NA,NA,Chordata,Europe,NA,Germany
"Bista, I; Carvalho, GR; Walsh, K; Seymour, M; Hajibabaei, M; Lallias, D; Christmas, M; Creer, S",Annual time-series analysis of aqueous eDNA reveals ecologically relevant dynamics of lake ecosystem biodiversity,NATURE COMMUNICATIONS,DNA,1,0,2017,1,0.4_1,Cellulose_Nitrate,PCI_alt,COI,0,0,0,0,0,0,0,1,0,0,0,0,0,0,0,0,0,0,0,0,0,0,0,0,0,0,0,fresh,1,0,Lake,Non target,OTU,0,1,0,103,NA,NA,NA,Arthropoda,Europe,NA,UK
"Bakker, J; Wangensteen, OS; Chapman, DD; Boussarie, G; Buddo, D; Guttridge, TL; Hertler, H; Mouillot, D; Vigliola, L; Mariani, S",Environmental DNA reveals tropical shark diversity in contrasting levels of anthropogenic impact,SCIENTIFIC REPORTS,DNA,1,0,2017,4,0.4_1,Cellulose,QPS_Kit,COI,0,0,0,0,0,0,0,1,0,0,0,0,0,0,0,0,0,0,0,0,0,0,0,0,0,0,0,marine,0,1,"Coastal Ocean, Open Ocean",Fish,OTU,0,1,0,22,NA,NA,NA,Chordata,North America,Caribbean,"Belize, Jamaica, Bahamas, New Caledonia, Turks, Caicos Islands"
"Evans, NT; Li, YY; Renshaw, MA; Olds, BP; Deiner, K; Turner, CR; Jerde, CL; Lodge, DM; Lamberti, GA; Pfrender, ME",Fish community assessment with eDNA metabarcoding: effects of sampling design and bioinformatic filtering,CANADIAN JOURNAL OF FISHERIES AND AQUATIC SCIENCES,DNA,1,0,2017,0.25,>1,Polycarbonate,PCI_alt,"cytb, 12S, 16S",1,0,0,0,0,0,1,0,0,0,1,0,0,0,0,0,0,0,0,0,0,0,0,0,0,0,0,fresh,1,0,Pond,Fish,Species,0,0,1,NA,NA,65,NA,Chordata,North America,NA,USA
"Bylemans, J; Gleeson, DM; Hardy, CM; Furlan, E",Toward an ecoregion scale evaluation of eDNA metabarcoding primers: A case study for the freshwater fish biodiversity of the Murray-Darling Basin (Australia),ECOLOGY AND EVOLUTION,DNA,1,0,2018,2,>1,Glass_Fiber,QPW_Kit,12S,0,0,0,0,0,0,0,0,0,0,1,0,0,0,0,0,0,0,0,0,0,0,0,0,0,0,0,fresh,1,0,River,Fish,OTU,0,1,0,NA,NA,NA,NA,Chordata,Oceania,NA,Australia
"Pont, D., Rocle, M., Valentini, A., Civade, R., Jean, P., Maire, A., Roset, N., Schabuss, M., Zornig, H. and Dejean, T",Environmental DNA reveals quantitative patterns of fish biodiversity in large rivers despite its downstream transportation,SCIENTIFIC REPORTS,DNA,1,0,2018,30,0.4_1,NA,MNS_Kit,12S,0,0,0,0,0,0,0,0,0,0,1,0,0,0,0,0,0,0,0,0,0,0,0,0,0,0,0,fresh,1,0,River,Fish,"OTU, Species",0,1,1,NA,NA,24,NA,Chordata,Europe,NA,France
"Nakagawa, H; Yamamoto, S; Sato, Y; Sado, T; Minamoto, T; Miya, M",Comparing local- and regional-scale estimations of the diversity of stream fish using eDNA metabarcoding and conventional observation methods,FRESHWATER BIOLOGY,DNA,1,0,2018,1,NA,Glass_Fiber,QBT_Kit_alt,12S,0,0,0,0,0,0,0,0,0,0,1,0,0,0,0,0,0,0,0,0,0,0,0,0,0,0,0,fresh,1,0,River,Fish,Species,0,0,1,NA,NA,55,NA,Chordata,Asia,NA,Japan
"Chiang, E; Schmidt, ML; Berry, MA; Biddanda, BA; Burtner, A; Johengen, TH; Palladino, D; Denef, VJ",Verrucomicrobia are prevalent in north-temperate freshwater lakes and display class-level preferences between lake habitats,PLOS ONE,DNA,1,0,2018,30,<0.22,Isopore,QAP_Kit,16S,1,0,0,0,0,0,0,0,0,0,0,0,0,0,0,0,0,0,0,0,0,0,0,0,0,0,0,fresh,1,0,Lake,Bacteria,OTU,0,0,0,NA,NA,NA,NA,Verrucomicrobia,North America,NA,USA
"Li, YZ; Hingamp, P; Watai, H; Endo, H; Yoshida, T; Ogata, H",Degenerate PCR Primers to Reveal the Diversity of Giant Viruses in Coastal Waters,VIRUSES-BASEL,DNA,1,0,2018,1,<0.22,Polycarbonate,SDS,16S,1,0,0,0,0,0,0,0,0,0,0,0,0,0,0,0,0,0,0,0,0,0,0,0,0,0,0,marine,0,1,Bay,Virus,OTU,0,1,0,"5,595",NA,NA,NA,NA,Asia,Northwest Pacific,Japan
"Flaviani, F; Schroeder, DC; Lebret, K; Balestreri, C; Highfield, AC; Schroeder, JL; Thorpe, SE; Moore, K; Pasckiewicz, K; Pfaff, MC; Rybicki, EP",Distinct Oceanic Microbiomes From Viruses to Protists Located Near the Antarctic Circumpolar Current,FRONTIERS IN MICROBIOLOGY,DNA,1,0,2018,0.25,0.4_1,Polycarbonate,QBT_Kit,"16S, 18S",1,1,0,0,0,0,0,0,0,0,0,0,0,0,0,0,0,0,0,0,0,0,0,0,0,0,0,marine,0,1,Open Ocean,Non target,OTU,0,1,0,"58,729",NA,NA,NA,>10,NA,"Indian Ocean, SOTUhern Ocean","Antarctica, SOTUh Africa, Australia"
"Menning, DM; Carraher-Stross, WA; Graham, ED; Thomas, DN; Phillips, AR; Scharping, RJ; Garey, JR",Aquifer Discharge Drives Microbial Community Change in Karst Estuaries,ESTUARIES AND COASTS,DNA,1,0,2018,0.5,<0.22,NA,QUF_Kit,"16S, 18S",1,1,0,0,0,0,0,0,0,0,0,0,0,0,0,0,0,0,0,0,0,0,0,0,0,0,0,marine,0,1,Estuary,Non target,OTU,0,1,0,NA,NA,NA,NA,>10,North America,Northwest Atlantic,USA
"Banerji, A; Bagley, M; Elk, M; Pilgrim, E; Martinson, J; Domingo, JS",Spatial and temporal dynamics of a freshwater eukaryotic plankton community revealed via 18S rRNA gene metabarcoding,HYDROBIOLOGIA,DNA,1,0,2018,0.1,0.4_1,Polycarbonate,QAP_Kit,18S,0,1,0,0,0,0,0,0,0,0,0,0,0,0,0,0,0,0,0,0,0,0,0,0,0,0,0,fresh,1,0,Lake,Non target,OTU,0,1,0,"1,341",NA,NA,NA,NA,North America,NA,USA
"Li, FL; Peng, Y; Fang, WD; Altermatt, F; Xie, YW; Yang, JH; Zhang, XW",Application of Environmental DNA Metabarcoding for Predicting Anthropogenic Pollution in Rivers,ENVIRONMENTAL SCIENCE & TECHNOLOGY,DNA,1,0,2018,0.225,<0.22,Nylon,QPW_Kit,"18S, 16S",1,1,0,0,0,0,0,0,0,0,0,0,0,0,0,0,0,0,0,0,0,0,0,0,0,0,0,fresh,1,0,River,Non target,OTU,0,1,0,"9,599",NA,NA,NA,NA,Asia,NA,China
"Grey, EK; Bernatchez, L; Cassey, P; Deiner, K; Deveney, M; Howland, KL; Lacoursiere-Roussel, A; Leong, SCY; Li, YY; Olds, B; Pfrender, ME; Prowse, TAA; Renshaw, MA; Lodge, DM",Effects of sampling effort on biodiversity patterns estimated from environmental DNA metabarcoding surveys,SCIENTIFIC REPORTS,DNA,1,0,2018,0.25,0.4_1,"Cellulose_Nitrate, Glass_Fiber",PCI_alt,"18S, COI",0,1,0,0,0,0,0,1,0,0,0,0,0,0,0,0,0,0,0,0,0,0,0,0,0,0,0,"fresh, marine",1,1,Coastal Ocean,Non target,OTU,0,1,0,795,NA,NA,NA,>10,"North America, Asia, Oceania",NA,"USA, Canada, Australia, Singapore"
"Djurhuus, A; Pitz, K; Sawaya, NA; Rojas-Marquez, J; Michaud, B; Montes, E; Muller-Karger, F; Breitbart, M",Evaluation of marine zooplankton community structure through environmental DNA metabarcoding,LIMNOLOGY AND OCEANOGRAPHY-METHODS,DNA,1,0,2018,1,<0.22,Nitrocellulose,QBT_Kit,"18S, COI",0,1,0,0,0,0,0,1,0,0,0,0,0,0,0,0,0,0,0,0,0,0,0,0,0,0,0,marine,0,1,Coral reef,Zooplankton,OTU,0,1,0,"12,639",NA,NA,NA,NA,North America,Northwest Atlantic,USA
"Fernandez, S; Rodriguez, S; Martinez, JL; Borrell, YJ; Ardura, A; Garcia-Vazquez, E",Evaluating freshwater macroinvertebrates from eDNA metabarcoding: A river Nalon case study,PLOS ONE,DNA,1,0,2018,1,<0.22,Polyethersulfone,QPW_Kit,"18S, COI",0,1,0,0,0,0,0,1,0,0,0,0,0,0,0,0,0,0,0,0,0,0,0,0,0,0,0,fresh,1,0,River,Non target,OTU,0,1,0,242,NA,NA,NA,>10,Europe,NA,Spain
"Kelly, RP; Gallego, R; Jacobs-Palmer, E",The effect of tides on nearshore environmental DNA,PEERJ,DNA,1,0,2018,0.5,0.4_1,Cellulose_Acetate,PCI,COI,0,0,0,0,0,0,0,1,0,0,0,0,0,0,0,0,0,0,0,0,0,0,0,0,0,0,0,marine,0,1,Estuary,Non target,OTU,0,1,0,"7,155",NA,NA,NA,NA,North America,Northeast Pacific,USA
"Macher, JN; Vivancos, A; Piggott, JJ; Centeno, FC; Matthaei, CD; Leese, F",Comparison of environmental DNA and bulk-sample metabarcoding using highly degenerate cytochrome c oxidase I primers,MOLECULAR ECOLOGY RESOURCES,DNA,1,0,2018,1,<0.22,Polycarbonate,Salt_ext_alt,COI,0,0,0,0,0,0,0,1,0,0,0,0,0,0,0,0,0,0,0,0,0,0,0,0,0,0,0,fresh,1,0,River,Non target,OTU,0,1,0,"5,819",NA,NA,NA,>10,Oceania,NA,New Zeland
"Lacoursiere-Roussel, A; Howland, K; Normandeau, E; Grey, EK; Archambault, P; Deiner, K; Lodge, DM; Hernandez, C; Leduc, N; Bernatchez, L",eDNA metabarcoding as a new surveillance approach for coastal Arctic biodiversity,ECOLOGY AND EVOLUTION,DNA,1,0,2018,0.25,0.4_1,Glass_Fiber,PCI_alt,COI,0,0,0,0,0,0,0,1,0,0,0,0,0,0,0,0,0,0,0,0,0,0,0,0,0,0,0,marine,0,1,Bay,Non target,Species,0,0,1,NA,NA,181,NA,>10,North America,Northwest Atlantic,Canada
"Baker, CS; Steel, D; Nieukirk, S; Klinck, H",Environmental DNA (eDNA) From the Wake of the Whales: Droplet Digital PCR for Detection and Species Identification,FRONTIERS IN MARINE SCIENCE,DNA,1,0,2018,1,0.4_1,Polycarbonate,PCI,"Dloop, cytb",0,0,0,0,0,0,1,0,0,1,0,0,0,0,0,0,0,0,0,0,0,0,0,0,0,0,0,marine,0,1,Bay,Mammal,NA,0,0,0,NA,NA,NA ,NA,Chordata,North America,Northeast Pacific,USA
"Cowart, DA; Murphy, KR; Cheng, CHC",Metagenomic sequencing of environmental DNA reveals marine faunal assemblages from the West Antarctic Peninsula,MARINE GENOMICS,DNA,1,0,2018,3,0.4_1,Nylon,QBT_Kit,Genomic,0,0,0,0,0,0,0,0,0,0,0,0,0,0,0,0,0,0,0,0,0,0,0,0,0,1,0,marine,0,1,Bay,Non target,OTU,0,1,0,563,NA,NA,NA,"Chordata, Mollusca, Arthropoda, Nematoda, Platyhelminthea, Annelida, Cnidaria, Tardigrada, Echinodermata, Porifera",Antarctica,SOTUhern Ocean,Antarctica
"Shinzato, C; Zayasu, Y; Kanda, M; Kawamitsu, M; Satoh, N; Yamashita, H; Suzuki, G",Using Seawater to Document Coral-Zoothanthella Diversity: A New Approach to Coral Reef Monitoring Using Environmental DNA,FRONTIERS IN MARINE SCIENCE,DNA,1,0,2018,3,0.4_1,Polycarbonate,BEM,"mtCR, ITS1, ITS2",0,0,0,0,1,1,0,0,0,1,0,0,0,0,0,0,0,0,0,0,0,0,0,0,0,0,0,marine,0,1,Coral reef,Invertebrate,NA,0,0,0,NA,NA,NA,NA,"Cnidaria, Dinoflagellata",Asia,Northwest Pacific,Japan
"Everett, MV; Park, LK",Exploring deep-water coral communities using environmental DNA,DEEP-SEA RESEARCH PART II-TOPICAL STUDIES IN OCEANOGRAPHY,DNA,1,0,2018,1,0.4_1,Nitrocellulose,PCI_alt,mutS,0,0,0,0,0,0,0,0,0,0,0,0,0,0,0,0,0,0,0,0,0,1,0,0,0,0,0,marine,0,1,Deep Ocean,Invertebrate,Species,0,0,1,NA,NA,27,NA,Cnidaria,North America,Northeast Pacific,USA
"Zhang, H; Yoshizawa, S; Iwasaki, W; Xian, WW",Seasonal Fish Assemblage Structure Using Environmental DNA in the Yangtze Estuary and Its Adjacent Waters,FRONTIERS IN MARINE SCIENCE,DNA,1,0,2019,2,<0.22,Polyethersulfone,QBT_Kit,12S,0,0,0,0,0,0,0,0,0,0,1,0,0,0,0,0,0,0,0,0,0,0,0,0,0,0,0,marine,0,1,Estuary,Fish,OTU,0,1,0,41,NA,NA,NA,Chordata,Asia,Northwest Pacific,China
"Closek, CJ; Santora, JA; Starks, HA; Schroeder, ID; Andruszkiewicz, EA; Sakuma, KM; Bograd, SJ; Hazenv, EL; Field, JC; Boehm, AB",Marine Vertebrate Biodiversity and Distribution Within the Central California Current Using Environmental DNA (eDNA) Metabarcoding and Ecosystem Surveys,FRONTIERS IN MARINE SCIENCE,DNA,1,0,2019,1,<0.22,Polyvinylidene_fluoride,QBT_Kit_alt,12S,0,0,0,0,0,0,0,0,0,0,1,0,0,0,0,0,0,0,0,0,0,0,0,0,0,0,0,marine,0,1,Coastal Ocean,Non target,OTU,0,1,0,1396,NA,NA,NA,Chordata,North America,Northeast Pacific,USA
"Cilleros, K; Valentini, A; Allard, L; Dejean, T; Etienne, R; Grenouillet, G; Iribar, A; Taberlet, P; Vigouroux, R; Brosse, S",Unlocking biodiversity and conservation studies in high-diversity environments using environmental DNA (eDNA): A test with Guianese freshwater fishes,MOLECULAR ECOLOGY RESOURCES,DNA,1,0,2019,50,0.4_1,NA,QBT_Kit,12S,0,0,0,0,0,0,0,0,0,0,1,0,0,0,0,0,0,0,0,0,0,0,0,0,0,0,0,fresh,1,0,River,Fish,"OTU, Species",0,1,1,148,NA,132,NA,Chordata,SOTUh America,NA,French Guiana
"Harper, LR; Handley, LL; Carpenter, AI; Ghazali, M; Di Muri, C; Macgregor, CJ; Logan, TW; Law, A; Breithaupt, T; Read, DS; McDevitt, AD; Hanfling, B",Environmental DNA (eDNA) metabarcoding of pond water as a tool to survey conservation and management priority mammals,BIOLOGICAL CONSERVATION,DNA,1,0,2019,2,0.4_1,Cellulose_Esters,MUW_Kit,12S,0,0,0,0,0,0,0,0,0,0,1,0,0,0,0,0,0,0,0,0,0,0,0,0,0,0,0,fresh,1,0,Pond,Mammal,Species,0,0,1,NA,NA,59,NA,Chordata,Europe,NA,UK
"Fujii, K; Doi, H; Matsuoka, S; Nagano, M; Sato, H; Yamanaka, H",Environmental DNA metabarcoding for fish community analysis in backwater lakes: A comparison of capture methods,PLOS ONE,DNA,1,0,2019,1,0.4_1,Glass_Fiber,QBT_Kit_alt,12S,0,0,0,0,0,0,0,0,0,0,1,0,0,0,0,0,0,0,0,0,0,0,0,0,0,0,0,fresh,1,0,Lake,Fish,Species,0,0,1,NA,NA,24,NA,Chordata,Asia,NA,Japan
"Liu, Y; Wikfors, GH; Rose, JM; McBride, RS; Milke, LM; Mercaldo-Allen, R",Application of Environmental DNA Metabarcoding to Spatiotemporal Finfish Community Assessment in a Temperate Embayment,FRONTIERS IN MARINE SCIENCE,DNA,1,0,2019,1,0.4_1,Polycarbonate,QPW_Kit,12S,0,0,0,0,0,0,0,0,0,0,1,0,0,0,0,0,0,0,0,0,0,0,0,0,0,0,0,marine,0,1,Bay,Fish,Species,0,0,1,NA,NA,24,NA,Chordata,North America,Northwest Atlantic,USA
"Stat, M; John, J; DiBattista, JD; Newman, SJ; Bunce, M; Harvey, ES",Combined use of eDNA metabarcoding and video surveillance for the assessment of fish biodiversity,CONSERVATION BIOLOGY,DNA,1,0,2019,0.5,0.4_1,Polyethersulfone,QBT_Kit,16S,1,0,0,0,0,0,0,0,0,0,0,0,0,0,0,0,0,0,0,0,0,0,0,0,0,0,0,marine,0,1,"Coral reef, Seagrass bed",Fish,Species,0,0,1,NA,NA,82,NA,Chordata,Oceania,Indian Ocean,Australia
"Ribeiro, H; Martins, A; Goncalves, M; Guedes, M; Tomasino, MP; Dias, N; Dias, A; Mucha, AP; Carvalho, MF; Almeida, CMR; Ramos, S; Almeida, JM; Silva, E; Magalhaes, C",Development of an autonomous biosampler to capture in situ aquatic microbiomes,PLOS ONE,DNA,1,0,2019,3,<0.22,Polyethersulfone,QPW_Kit,"16S, 18S",1,1,0,0,0,0,0,0,0,0,0,0,0,0,0,0,0,0,0,0,0,0,0,0,0,0,0,marine,0,1,Coastal Ocean,Non target,OTU,0,1,0,725,NA,NA,NA,NA,Europe,Northeast Atlantic,Portugal
"Jeunen, GJ; Knapp, M; Spencer, HG; Lamare, MD; Taylor, HR; Stat, M; Bunce, M; Gemmell, NJ",Environmental DNA (eDNA) metabarcoding reveals strong discrimination among diverse marine habitats connected by water movement,MOLECULAR ECOLOGY RESOURCES,DNA,1,0,2019,2,>1,Cellulose_Nitrate,PCI_alt,"16S, COI",1,0,0,0,0,0,0,1,0,0,0,0,0,0,0,0,0,0,0,0,0,0,0,0,0,0,0,marine,0,1,Bay,Non target,OTU,0,1,0,"2,331",NA,NA,NA,"Ochrophyta, Rhodophyta, Chordata, Mollusca, Porifera, Bacillarioohyta, Annelida, Arthropoda, Cnidara, Echinodermata",Oceania,SOTUhwest Pacific,New Zeland
"Ramond, P; Sourisseau, M; Simon, N; Romac, S; Schmitt, S; Rigaut-Jalabert, F; Henry, N; de Vargas, C; Siano, R",Coupling between taxonomic and functional diversity in Protist coastal communities,ENVIRONMENTAL MICROBIOLOGY,DNA,1,0,2019,7.5,<0.22,Polycarbonate,MNP_Kit,18S,0,1,0,0,0,0,0,0,0,0,0,0,0,0,0,0,0,0,0,0,0,0,0,0,0,0,0,marine,0,1,Coastal Ocean,Protist,OTU,0,1,0,NA,NA,NA,NA,>10,"Europe, Africa",Northeast Atlantic,"France, Senegal"
"Liu, YT; He, H; Fu, L; Liu, Q; Yang, ZS; Zhen, Y","Environmental DNA Sequencing Reveals a Highly Complex Eukaryote Community in Sansha Yongle Blue Hole, Xisha, SOTUh China Sea",MICROORGANISMS,DNA,1,0,2019,4,<0.22,NA,CTAB,18S,0,1,0,0,0,0,0,0,0,0,0,0,0,0,0,0,0,0,0,0,0,0,0,0,0,0,0,marine,0,1,Coastal Ocean,Non target,OTU,0,1,0,"6,093",NA,NA,NA,>10,Asia,Northwest Pacific,China
"Filker, S; Kuhner, S; Heckwolf, M; Dierking, J; Stoeck, T",A fundamental difference between macrobiota and microbial eukaryotes: Protist plankton has a species maximum in the freshwater-marine transition zone of the Baltic Sea,ENVIRONMENTAL MICROBIOLOGY,DNA,1,0,2019,5,0.4_1,Polycarbonate,QAP_Kit,18S,0,1,0,0,0,0,0,0,0,0,0,0,0,0,0,0,0,0,0,0,0,0,0,0,0,0,0,marine,0,1,Coastal Ocean,Non target,OTU,0,1,0,343,NA,NA,NA,NA,Europe,Baltic Sea,Germany
"Minicante, SA; Piredda, R; Quero, GM; Finotto, S; Aubry, FB; Bastianini, M; Pugnetti, A; Zingone, A","Habitat Heterogeneity and Connectivity: Effects on the Planktonic Protist Community Structure at Two Adjacent Coastal Sites (the Lagoon and the Gulf of Venice, Northern Adriatic Sea, Italy) Revealed by Metabarcoding",FRONTIERS IN MICROBIOLOGY,DNA,1,0,2019,3,>1,Cellulose_Esters,QDP_Kit,18S,0,1,0,0,0,0,0,0,0,0,0,0,0,0,0,0,0,0,0,0,0,0,0,0,0,0,0,marine,0,1,Lagoon,Non target,OTU,0,1,0,"4,506",NA,NA,NA,NA,Europe,Mediterranean Sea,Italy
"Metz, S; Singer, D; Domaizon, I; Unrein, F; Lara, E",Global distribution of Trebouxiophyceae diversity explored by high-throughput sequencing and phylogenetic approaches,ENVIRONMENTAL MICROBIOLOGY,DNA,1,0,2019,1,<0.22,Polycarbonate,QPS_Kit,18S,0,1,0,0,0,0,0,0,0,0,0,0,0,0,0,0,0,0,0,0,0,0,0,0,0,0,0,"fresh, marine",1,1,"Lake, Open Ocean",Algae,OTU,0,1,0,961,NA,NA,NA,Chlorophyta,"SOTUh America, Africa, Europe, Asia",NA,NA
"Jo, H; Kim, DK; Park, K; Kwak, IS",Discrimination of Spatial Distribution of Aquatic Organisms in a Coastal Ecosystem Using eDNA,APPLIED SCIENCES-BASEL,DNA,1,0,2019,1,0.4_1,Cellulose_Esters,QPS_Kit,18S,0,1,0,0,0,0,0,0,0,0,0,0,0,0,0,0,0,0,0,0,0,0,0,0,0,0,0,marine,0,1,Bay,Non target,OTU,0,1,0,352,NA,NA,NA,NA,Asia,Northwest Pacific,SOTUh Korea
"Kim, DK; Park, K; Jo, H; Kwak, IS","Comparison of Water Sampling between Environmental DNA Metabarcoding and Conventional Microscopic Identification: A Case Study in Gwangyang Bay, SOTUh Korea",APPLIED SCIENCES-BASEL,DNA,1,0,2019,1,0.4_1,Cellulose_Esters,QPS_Kit,18S,0,1,0,0,0,0,0,0,0,0,0,0,0,0,0,0,0,0,0,0,0,0,0,0,0,0,0,marine,0,1,Bay,Non target,OTU,0,1,0,552,NA,NA,NA,>10,Asia,Northwest Pacific,SOTUh Korea
"Cordier, T; Frontalini, F; Cermakova, K; Apotheloz-Perret-Gentil, L; Treglia, M; Scantamburlo, E; Bonamin, V; Pawlowski, J",Multi-marker eDNA metabarcoding survey to assess the environmental impact of three offshore gas platforms in the North Adriatic Sea (Italy),MARINE ENVIRONMENTAL RESEARCH,DNA,1,0,2019,0.5,NA,Glass_Fiber,QBT_Kit,"18S, 16S, COI",1,1,0,0,0,0,0,1,0,0,0,0,0,0,0,0,0,0,0,0,0,0,0,0,0,0,0,marine,0,1,Open Ocean,Non target,OTU,0,1,0,"1,416",NA,NA,NA,>10,Europe,Mediterranean Sea,Italy
"Holman, LE; de Bruyn, M; Creer, S; Carvalho, G; Robidart, J; Rius, M",Detection of introduced and resident marine species using environmental DNA metabarcoding of sediment and water,SCIENTIFIC REPORTS,DNA,1,0,2019,0.4,<0.22,Polyethersulfone,QBT_Kit,"18S, COI",0,1,0,0,0,0,0,1,0,0,0,0,0,0,0,0,0,0,0,0,0,0,0,0,0,0,0,marine,0,1,Coastal Ocean,Non target,OTU,0,1,0,200,NA,NA,NA,"Annelida, Arthropoda, Bryozoa, Chlorophyta, Cnidaria, Ciliophora, Chordata, Mollusca, Nematoda, Platyhelminthes",Europe,Northeast Atlantic,UK
"Hajibabaei, M; Porter, TM; Robinson, CV; Baird, DJ; Shokralla, S; Wright, MTG",Watered-down biodiversity? A comparison of metabarcoding results from DNA extracted from matched water and bulk tissue biomonitoring samples,PLOS ONE,DNA,1,0,2019,1,<0.22,NA,QPW_Kit,COI,0,0,0,0,0,0,0,1,0,0,0,0,0,0,0,0,0,0,0,0,0,0,0,0,0,0,0,fresh,1,0,Wetland,Invertebrate,ASV,1,0,0,NA,"4,459",NA,NA,Arthropoda,North America,NA,Canada
"Beentjes, KK; Speksnijder, AGCL; Schilthuizen, M; Hoogeveen, M; van der Hoorn, BB",The effects of spatial and temporal replicate sampling on eDNA metabarcoding,PEERJ,DNA,1,0,2019,0.3,<0.22,Polyethersulfone,CTAB_alt,COI,0,0,0,0,0,0,0,1,0,0,0,0,0,0,0,0,0,0,0,0,0,0,0,0,0,0,0,fresh,1,0,Lake,Non target,OTU,0,1,0,"1,314",NA,NA,NA,NA,Europe,NA,Netherlands
"Bakker, J; Wangensteen, OS; Baillie, C; Buddo, D; Chapman, DD; Gallagher, AJ; Guttridge, TL; Hertler, H; Mariani, S",Biodiversity assessment of tropical shelf eukaryotic communities via pelagic eDNA metabarcoding,ECOLOGY AND EVOLUTION,DNA,1,0,2019,4,0.4_1,Cellulose_Esters,QPS_Kit,COI,0,0,0,0,0,0,0,1,0,0,0,0,0,0,0,0,0,0,0,0,0,0,0,0,0,0,0,marine,0,1,Coastal Ocean,Non target,OTU,0,1,0,"6,357",NA,NA,NA,NA,North America,Caribbean,"Jamaica, Belize, Turks and Caicos Islands, Bahamas"
"Fernandez, S; Arboleya, E; Dopico, E; Ardura, A; Garcia-Vazquez, E",Non-indigenous fish in protected spaces: Trends in species distribution mediated by illegal stocking,AQUATIC CONSERVATION-MARINE AND FRESHWATER ECOSYSTEMS,DNA,1,0,2019,1,<0.22,Polyethersulfone,QPW_Kit,COI,0,0,0,0,0,0,0,1,0,0,0,0,0,0,0,0,0,0,0,0,0,0,0,0,0,0,0,fresh,1,0,River,Fish,Species,0,0,1,NA,NA,3,NA,Chordata,Europe,NA,Spain
"Collins, RA; Bakker, J; Wangensteen, OS; Soto, AZ; Corrigan, L; Sims, DW; Genner, MJ; Mariani, S",Non-specific amplification compromises environmental DNA metabarcoding with COI,METHODS IN ECOLOGY AND EVOLUTION,DNA,1,0,2019,2,<0.22,Polyethersulfone,QPS_Kit,"COI, 12S",1,0,0,0,0,0,1,1,0,0,1,0,0,0,0,0,0,0,0,0,0,0,0,0,0,0,0,"fresh, marine",1,1,"River, Estuary, Bay",Fish,Species,0,0,1,NA,NA,86,NA,Chordata,Europe,Northeast Atlantic,UK
"Rey, A; Carney, KJ; Quinones, LE; Lohan, KMP; Ruiz, GM; Basurko, OC; Rodriguez-Ezpeleta, N",Environmental DNA Metabarcoding: A Promising Tool for Ballast Water Monitoring,ENVIRONMENTAL SCIENCE & TECHNOLOGY,DNA,1,0,2019,1,0.4_1,Cellulose,QBT_Kit_alt,"COI, 18S",0,1,0,0,0,0,0,1,0,0,0,0,0,0,0,0,0,0,0,0,0,0,0,0,0,0,0,marine,0,1,Coastal Ocean,Non target,OTU,0,1,0,30,NA,NA,NA,"Arthropoda, Annelida, Mollusca, Chordata, Cnidaria, Porifera, Gastrotricha",North America,Northwest Atlantic,USA
"Sawaya, NA; Djurhuus, A; Closek, CJ; Hepner, M; Olesin, E; Visser, L; Kelble, C; Hubbard, K; Breitbart, M",Assessing eukaryotic biodiversity in the Florida Keys National Marine Sanctuary through environmental DNA metabarcoding,ECOLOGY AND EVOLUTION,DNA,1,0,2019,1,<0.22,Polyvinylidene_fluoride,QBT_Kit_alt,"COI, 18S",0,1,0,0,0,0,0,1,0,0,0,0,0,0,0,0,0,0,0,0,0,0,0,0,0,0,0,marine,0,1,Coral reef,Non target,"OTU, Species",0,1,1,"3,891",NA,918,NA,NA,North America,Northwest Atlantic,USA
"Lecaudey, LA; Schletterer, M; Kuzovlev, VV; Hahn, C; Weiss, SJ",Fish diversity assessment in the headwaters of the Volga River using environmental DNA metabarcoding,AQUATIC CONSERVATION-MARINE AND FRESHWATER ECOSYSTEMS,DNA,1,0,2019,0.25,0.4_1,Glass_Fiber,PCI_alt,"cytb, 12S, 16S",1,0,0,0,0,0,1,0,0,0,1,0,0,0,0,0,0,0,0,0,0,0,0,0,0,0,0,fresh,1,0,River,Fish,Species,0,0,1,NA,NA,23,NA,Chordata,Europe,NA,Russia
"Zhang, S; Lu, Q; Wang, YY; Wang, XM; Zhao, JD; Yao, M",Assessment of fish communities using environmental DNA: Effect of spatial sampling design in lentic systems of different sizes,MOLECULAR ECOLOGY RESOURCES,DNA,1,0,2020,1,>1,Cellulose_Esters,QBT_Kit_alt,12S,0,0,0,0,0,0,0,0,0,0,1,0,0,0,0,0,0,0,0,0,0,0,0,0,0,0,0,fresh,1,0,Lake,Fish,"OTU, Species",0,1,1,49,NA,37,NA,Chordata,Asia,NA,China
"Jia, H; Wang, YB; Yoshizawa, S; Iwasaki, W; Li, YQ; Xian, WW; Zhang, H",Seasonal Variation and Assessment of Fish Resources in the Yangtze Estuary Based on Environmental DNA,WATER,DNA,1,0,2020,1.5,<0.22,Polyethersulfone,QBT_Kit,12S,0,0,0,0,0,0,0,0,0,0,1,0,0,0,0,0,0,0,0,0,0,0,0,0,0,0,0,marine,0,1,Estuary,Fish,Species,0,0,1,NA,NA,59,NA,Chordata,Asia,Northwest Pacific,China
"GOTUte, A; Molbert, N; Guerin, S; Richoux, R; Rocher, V",Monitoring freshwater fish communities in large rivers using environmental DNA metabarcoding and a long-term electrofishing survey,JOURNAL OF FISH BIOLOGY,DNA,1,0,2020,30,0.4_1,NA,QBT_Kit,12S,0,0,0,0,0,0,0,0,0,0,1,0,0,0,0,0,0,0,0,0,0,0,0,0,0,0,0,fresh,1,0,River,Fish,Species,0,0,1,NA,NA,31,NA,Chordata,Europe,NA,France
"Imamura, A; Hayami, K; Sakata, MK; Minamoto, T","Environmental DNA revealed the fish community of Hokkaido Island, Japan, after invasion by rainbow trOTU",BIODIVERSITY DATA JOURNAL,DNA,1,0,2020,0.9,0.4_1,Glass_Fiber,QBT_Kit,12S,0,0,0,0,0,0,0,0,0,0,1,0,0,0,0,0,0,0,0,0,0,0,0,0,0,0,0,fresh,1,0,River,Fish,Species,0,0,1,NA,NA,23,NA,Chordata,Asia,NA,Japan
"Fraija-Fernandez, N; Bouquieaux, MC; Rey, A; Mendibil, I; Cotano, U; Irigoien, X; Santos, M; Rodriguez-Ezpeleta, N",Marine water environmental DNA metabarcoding provides a comprehensive fish diversity assessment and reveals spatial patterns in a large oceanic area,ECOLOGY AND EVOLUTION,DNA,1,0,2020,5,0.4_1,Polyethersulfone,QBT_Kit_alt,12S,0,0,0,0,0,0,0,0,0,0,1,0,0,0,0,0,0,0,0,0,0,0,0,0,0,0,0,marine,0,1,Bay,Fish,Species,0,0,1,NA,NA,116,NA,Chordata,Europe,Northeast Atlantic,"France, Spain"
"Archana, A; Baker, DM",Multifunctionality of an Urbanized Coastal Marine Ecosystem,FRONTIERS IN MARINE SCIENCE,DNA,1,0,2020,1,<0.22,Polyethersulfone,QBT_Kit_alt,12S,0,0,0,0,0,0,0,0,0,0,1,0,0,0,0,0,0,0,0,0,0,0,0,0,0,0,0,marine,0,1,Coral reef,Fish,Species,0,0,1,NA,NA,91,NA,Chordata,Asia,Northwest Pacific,China
"Sigsgaard, EE; Torquato, F; Froslev, TG; Moore, ABM; Sorensen, JM; Range, P; Ben-Hamadou, R; Bach, SS; Moller, PR; Thomsen, PF",Using vertebrate environmental DNA from seawater in biomonitoring of marine habitats,CONSERVATION BIOLOGY,DNA,1,0,2020,1,<0.22,Polyethersulfone,QBT_Kit_alt,12S,0,0,0,0,0,0,0,0,0,0,1,0,0,0,0,0,0,0,0,0,0,0,0,0,0,0,0,marine,0,1,"Seagrass bed, Coral reef, Coastal Ocean, Open Ocean",Non target,Species,0,0,1,NA,NA,191,NA,Chordata,Asia,Indian Ocean,Qatar
"Griffiths, NP; Bolland, JD; Wright, RM; Murphy, LA; Donnelly, RK; Watson, HV; Hanfling, B",EnvironmentalDNAmetabarcoding provides enhanced detection of the European eelAnguilla anguillaand fish community structure in pumped river catchments,JOURNAL OF FISH BIOLOGY,DNA,1,0,2020,2,0.4_1,Cellulose_Nitrate,QPW_Kit,12S,0,0,0,0,0,0,0,0,0,0,1,0,0,0,0,0,0,0,0,0,0,0,0,0,0,0,0,fresh,1,0,River,Fish,Species,0,0,1,NA,NA,26,NA,Chordata,Europe,NA,UK
"Sales, NG; McKenzie, MB; Drake, J; Harper, LR; Browett, SS; Coscia, I; Wangensteen, OS; Baillie, C; Bryce, E; Dawson, DA; Ochu, E; Haenfling, B; Handley, LL; Mariani, S; Lambin, X; Sutherland, C; McDevitt, AD",Fishing for mammals: Landscape-level monitoring of terrestrial and semi-aquatic communities using eDNA from riverine systems,JOURNAL OF APPLIED ECOLOGY,DNA,1,0,2020,2,0.4_1,Polyethersulfone,QPW_Kit,12S,0,0,0,0,0,0,0,0,0,0,1,0,0,0,0,0,0,0,0,0,0,0,0,0,0,0,0,fresh,1,0,River,Mammal,Species,0,0,1,NA,NA,23,NA,Chordata,Europe,NA,UK
