authors,title,source,DNA_RNA,DNA,RNA,year,volume_l,filter_size_µm,filter_type,DNA_extr,loci,16S,18S,23S,28S,ITS2,ITS1,cytb,CO1,NADH4,D-loop,12S,rbcL,rrnA,arrA,cbbL,nifH,aprA,rpoC1,pufM,luxA,amoA,mutS,phnD,LSU rDNA,tufA,genome,transcriptome,water,fresh,marine,system,type_organism,id_type,ASV,OTU,Species,max_OTUs,max_ASV,max_spp,max_spp_other,phylum,continent,region,country
"Suzuki, MT; Rappe, MS; Haimberger, ZW; Winfield, H; Adair, N; Strobel, J; Giovannoni, SJ",Bacterial diversity among small-subunit rRNA gene clones and cellular isolates from the same seawater sample,APPLIED AND ENVIRONMENTAL MICROBIOLOGY,DNA,1,0,1997,16,<0.22,Polysulfone,PCI,16S,1,0,0,0,0,0,0,0,0,0,0,0,0,0,0,0,0,0,0,0,0,0,0,0,0,0,0,marine,0,1,Bay,Bacteria,Species,0,0,1,NA,NA,58,NA,"Proteobacteria, Bacteroidetes, Actinobacteria",North America,Northeast Pacific,USA
"Rappe, MS; Kemp, PF; Giovannoni, SJ","Phylogenetic diversity of marine coastal picoplankton 16S rRNA genes cloned from the continental shelf off Cape Hatteras, North Carolina",LIMNOLOGY AND OCEANOGRAPHY,DNA,1,0,1997,NA,<0.22,NA,PCI,16S,1,0,0,0,0,0,0,0,0,0,0,0,0,0,0,0,0,0,0,0,0,0,0,0,0,0,0,marine,0,1,Coastal Ocean,Bacteria,Species,0,0,1,NA,NA,50,NA,Proteobacteria,North America,Northwest Atlantic,USA
"Podgorsek, L; Petri, R; Imhoff, JF","Cultured and genetic diversity, and activities of sulfur-oxidizing bacteria in low-temperature hydrothermal fluids of the North Fiji Basin",MARINE ECOLOGY PROGRESS SERIES,DNA,1,0,2004,1.5,<0.22,Polycarbonate,QAM_Kit,16S,1,0,0,0,0,0,0,0,0,0,0,0,0,0,0,0,0,0,0,0,0,0,0,0,0,0,0,marine,0,1,Deep Ocean,Bacteria,Species,0,0,1,NA,NA,16,NA,NA,Oceania,SOTUh Pacific Ocean,Fiji
"Bernhard, AE; Colbert, D; McManus, J; Field, KG",Microbial community dynamics based on 16S rRNA gene profiles in a Pacific Northwest estuary and its tributaries,FEMS MICROBIOLOGY ECOLOGY,DNA,1,0,2005,1,<0.22,Polyethersulfone,PCI_alt,16S,1,0,0,0,0,0,0,0,0,0,0,0,0,0,0,0,0,0,0,0,0,0,0,0,0,0,0,marine,0,1,Bay,Non target,NA,0,0,0,NA,NA,NA,NA,"Proteobacteria, Cyanophyta, Bacteroidetes",North America,Northeast Pacific,USA
"Langlois, RJ; LaRoche, J; Raab, PA",Diazotrophic diversity and distribution in the tropical and subtropical Atlantic ocean,APPLIED AND ENVIRONMENTAL MICROBIOLOGY,DNA,1,0,2005,4.75,<0.22,Polysulfone,QDP_Kit,nifH,0,0,0,0,0,0,0,0,0,0,0,0,0,0,0,1,0,0,0,0,0,0,0,0,0,0,0,marine,0,1,Open Ocean,Bacteria,Species,0,0,1,NA,NA,170,NA,"Proteobacteria, Cyanophyta",Europe,Northeast Atlantic,Germany
"Burr, MD; Clark, SJ; Spear, CR; Camper, AK",Denaturing gradient gel electrophoresis can rapidly display the bacterial diversity contained in 16S rDNA clone libraries,MICROBIAL ECOLOGY,DNA,1,0,2006,0.2,<0.22,Polycarbonate,MPFD_kit,16S,1,0,0,0,0,0,0,0,0,0,0,0,0,0,0,0,0,0,0,0,0,0,0,0,0,0,0,fresh,1,0,Pond,Bacteria,NA,0,0,0,NA,NA,NA,NA,NA,NA,NA,USA
"Hollibaugh, JT; Budinoff, C; Hollibaugh, RA; Ransom, B; Bano, N",Sulfide oxidation coupled to arsenate reduction by a diverse microbial community in a Soda Lake,APPLIED AND ENVIRONMENTAL MICROBIOLOGY,DNA,1,0,2006,0.21,<0.22,NA,QPS_Kit,"rrnA, cbbL, arrA",0,0,0,0,0,0,0,0,0,0,0,0,1,1,1,0,0,0,0,0,0,0,0,0,0,0,0,fresh,1,0,Lake,Bacteria,NA,0,0,0,NA,NA,NA,NA,NA,North America,NA,USA
"Huber, JA; Mark Welch, D; Morrison, HG; Huse, SM; Neal, PR; Butterfield, DA; Sogin, ML",Microbial population structures in the deep marine biosphere,SCIENCE,DNA,1,0,2007,2,<0.22,Polyethersulfone,PCI_alt,16S,1,0,0,0,0,0,0,0,0,0,0,0,0,0,0,0,0,0,0,0,0,0,0,0,0,0,0,marine,0,1,Deep Ocean,Non target,OTU,0,1,0,"1,900",NA,NA,NA,>10,North America,Northeast Pacific,USA
"Meyer, B; Kuever, J","Molecular analysis of the diversity of sulfate-reducing and sulfur-oxidizing prokaryotes in the environment, using aprA as functional marker gene",APPLIED AND ENVIRONMENTAL MICROBIOLOGY,DNA,1,0,2007,15,<0.22,Polyethersulfone,PCI,"aprBA, 16S",1,0,0,0,0,0,0,0,0,0,0,0,0,0,0,0,1,0,0,0,0,0,0,0,0,0,0,marine,0,1,Bay,Non target,OTU,0,1,0,NA,NA,NA,NA,>10,North America,Caribbean,Montserrat
"Costas, BA; McManus, G; Doherty, M; Katz, LA",Use of species-specific primers and PCR to measure the distributions of planktonic ciliates in coastal waters,LIMNOLOGY AND OCEANOGRAPHY-METHODS,DNA,1,0,2007,5.85,>1,Cellulose_Nitrate,PCI_alt,ITS2,0,0,0,0,1,0,0,0,0,0,0,0,0,0,0,0,0,0,0,0,0,0,0,0,0,0,0,marine,0,1,Coastal Ocean,Protozoan,NA,0,0,0,NA,NA,NA,NA,Ciliophora,North America,Northwest Atlantic,USA
"Muhling, M; Woolven-Allen, J; Murrell, JC; Joint, I",Improved group-specific PCR primers for denaturing gradient gel electrophoresis analysis of the genetic diversity of complex microbial communities,ISME JOURNAL,DNA,1,0,2008,5.5,<0.22,Polyethersulfone,PCI,16S,1,0,0,0,0,0,0,0,0,0,0,0,0,0,0,0,0,0,0,0,0,0,0,0,0,0,0,marine,0,1,"Coastal Ocean, Open Ocean",Non target,NA,0,0,0,NA,NA,NA,NA,>10,Europe,Northeast Atlantic,Norway
"Stevens, H; Ulloa, O",Bacterial diversity in the oxygen minimum zone of the eastern tropical SOTUh Pacific,ENVIRONMENTAL MICROBIOLOGY,DNA,1,0,2008,10,<0.22,Polysulfone,PCI_alt,16S,1,0,0,0,0,0,0,0,0,0,0,0,0,0,0,0,0,0,0,0,0,0,0,0,0,0,0,marine,0,1,"Coastal Ocean, Open Ocean",Bacteria,OTU,0,1,0,60,NA,NA,NA,>10,SOTUh America,SOTUheast Pacific,Chile
"Amaral-Zettler, LA; Rocca, JD; Lamontagne, MG; Dennett, MR; Gast, RJ",Changes in microbial community structure in the wake of Hurricanes Katrina and Rita,ENVIRONMENTAL SCIENCE & TECHNOLOGY,DNA,1,0,2008,NA,<0.22,Polyethersulfone,QGC_Kit_alt,16S,1,0,0,0,0,0,0,0,0,0,0,0,0,0,0,0,0,0,0,0,0,0,0,0,0,0,0,fresh,1,0,Lake,Non target,OTU,0,1,0,"2,139",NA,NA,NA,>10,North America,NA,USA
"Langlois, RJ; Hummer, D; LaRoche, J",Abundances and distributions of the dominant nifH phylotypes in the Northern Atlantic Ocean,APPLIED AND ENVIRONMENTAL MICROBIOLOGY,DNA,1,0,2008,4,<0.22,Polysulfone,QDP_Kit,nifH,0,0,0,0,0,0,0,0,0,0,0,0,0,0,0,1,0,0,0,0,0,0,0,0,0,0,0,marine,0,1,"Coastal Ocean, Open Ocean",Non target,NA,0,0,0,NA,NA,NA,NA,"Proteobacteria, Cyanophyta",Europe,Northeast Atlantic,Germany
"Yutin, N; Beja, O; Suzuki, MT",The use of denaturing gradient gel electrophoresis with fully degenerate pufM primers to monitor aerobic anoxygenic phototrophic assemblages,LIMNOLOGY AND OCEANOGRAPHY-METHODS,DNA,1,0,2008,15,<0.22,Polyethersulfone,PCI,pufM,0,0,0,0,0,0,0,0,0,0,0,0,0,0,0,0,0,0,1,0,0,0,0,0,0,0,0,marine,0,1,Coastal Ocean,Non target,NA,0,0,0,NA,NA,NA,NA,NA,Asia,Mediterranean Sea,Israel
"Ionescu, D; Penno, S; Haimovich, M; Rihtman, B; Goodwin, A; Schwartz, D; Hazanov, L; Chernihovsky, M; Post, AF; Oren, A",Archaea in the Gulf of Aqaba,FEMS MICROBIOLOGY ECOLOGY,DNA,1,0,2009,0.5,<0.22,Polycarbonate,PCI,16S,1,0,0,0,0,0,0,0,0,0,0,0,0,0,0,0,0,0,0,0,0,0,0,0,0,0,0,marine,0,1,Coastal Ocean,Archaea,NA,0,0,0,NA,NA,NA,NA,"Euryarchaeota, Crenarchaeota",Asia,Red Sea,Jordan
"Rodriguez-Martinez, R; Labrenz, M; del Campo, J; Forn, I; Jurgens, K; Massana, R","Distribution of the uncultured protist MAST-4 in the Indian Ocean, Drake Passage and Mediterranean Sea assessed by real-time quantitative PCR",ENVIRONMENTAL MICROBIOLOGY,DNA,1,0,2009,12.5,<0.22,Polyethersulfone,PCI,18S,0,1,0,0,0,0,0,0,0,0,0,0,0,0,0,0,0,0,0,0,0,0,0,0,0,0,0,marine,0,1,Open Ocean,Protist,NA,0,0,0,NA,NA,NA,NA,NA,"SOTUh America, Europe",Global,"Argentina, Spain"
"Gentile, G; De Luca, M; Denaro, R; La Cono, V; Smedile, F; Scarfi, S; De Domenico, E; De Domenico, M; Yakimov, MM",PCR-based detection of bioluminescent microbial populations in Tyrrhenian Sea,DEEP-SEA RESEARCH PART II-TOPICAL STUDIES IN OCEANOGRAPHY,DNA,1,0,2009,5,<0.22,Polycarbonate,QAP_Kit,"luxA, 16S",1,0,0,0,0,0,0,0,0,0,0,0,0,0,0,0,0,0,0,1,0,0,0,0,0,0,0,marine,0,1,Open Ocean,Bacteria,Species,0,0,1,NA,NA,8,NA,NA,Europe,Mediterranean Sea,Italy
"Tai, V; Palenik, B",Temporal variation of Synechococcus clades at a coastal Pacific Ocean monitoring site,ISME JOURNAL,DNA,1,0,2009,0.75,<0.22,Polysulfone,QBT_Kit_alt,rpoC1,0,0,0,0,0,0,0,0,0,0,0,0,0,0,0,0,0,1,0,0,0,0,0,0,0,0,0,marine,0,1,Coastal Ocean,Bacteria,NA,0,0,0,NA,NA,NA,NA,Cyanophyta,North America,Northeast Pacific,USA
"Stoeck, T; Bass, D; Nebel, M; Christen, R; Jones, MDM; Breiner, HW; Richards, TA",Multiple marker parallel tag environmental DNA sequencing reveals a highly complex eukaryotic community in marine anoxic water,MOLECULAR ECOLOGY,DNA,1,0,2010,10,0.4_1,Polyvinylidene_fluoride,PCI,18S,0,1,0,0,0,0,0,0,0,0,0,0,0,0,0,0,0,0,0,0,0,0,0,0,0,0,0,marine,0,1,Estuary,Non target,OTU,0,1,0,2633,NA,NA,NA,>10,Europe,Northeast Atlantic,Norway
"Mutlu, MB; Guven, K","Detection of prokaryotic microbial communities of Camalti Saltern, Turkey, by fluorescein in situ hybridization and real-time PCR",TURKISH JOURNAL OF BIOLOGY,DNA,1,0,2011,0.05,<0.22,Polysulfone,PCI,16S,1,0,0,0,0,0,0,0,0,0,0,0,0,0,0,0,0,0,0,0,0,0,0,0,0,0,0,marine,0,1,Pond,Non target,NA,0,0,0,NA,NA,NA,NA,NA,Asia,Mediterranean Sea,Turkey
"Bourbonnais, A; Juniper, SK; Butterfield, DA; Devol, AH; Kuypers, MMM; Lavik, G; Hallam, SJ; Wenk, CB; Chang, BX; Murdock, SA; Lehmann, MF",Activity and abundance of denitrifying bacteria in the subsurface biosphere of diffuse hydrothermal vents of the Juan de Fuca Ridge,BIOGEOSCIENCES,DNA,1,0,2012,1,<0.22,Polyethersulfone,PCI_alt,16S,1,0,0,0,0,0,0,0,0,0,0,0,0,0,0,0,0,0,0,0,0,0,0,0,0,0,0,marine,0,1,Deep Ocean,Non target,OTU,0,1,0,121,NA,NA,NA,>10,North America,"Northeast Pacific, Northwest Atlantic",Canada
"Covacevich, F; Silva, RI; Cumino, AC; Calo, G; Negri, RM; Salerno, GL",First archaeal rDNA sequences from Argentine coastal waters: Unexpected PCR characterization using eukaryotic primers,CIENCIAS MARINAS,DNA,1,0,2012,2.5,<0.22,Polycarbonate,PCI,18S,0,1,0,0,0,0,0,0,0,0,0,0,0,0,0,0,0,0,0,0,0,0,0,0,0,0,0,marine,0,1,"Coastal Ocean, Open Ocean",Archaea,NA,0,0,0,NA,NA,NA,NA,>10,SOTUh America,SOTUhwest Atlantic,Argentina
"Abell, GCJ; Robert, SS; Frampton, DMF; Volkman, JK; Rizwi, F; Csontos, J; Bodrossy, L","High-Throughput Analysis of Ammonia Oxidiser Community Composition via a Novel, amoA-Based Functional Gene Array",PLOS ONE,DNA,1,0,2012,1,<0.22,Polycarbonate,MPFD_kit,amoA,0,0,0,0,0,0,0,0,0,0,0,0,0,0,0,0,0,0,0,0,1,0,0,0,0,0,0,marine,0,1,Open Ocean,Non target,NA,0,0,0,NA,NA,NA,NA,>10,Oceania,Indo-Pacific,Australia
"Takahara, T; Minamoto, T; Yamanaka, H; Doi, H; Kawabata, Z",Estimation of Fish Biomass Using Environmental DNA,PLOS ONE,DNA,1,0,2012,0.02,0.4_1,Polycarbonate,QBT_Kit,cytb,0,0,0,0,0,0,1,0,0,0,0,0,0,0,0,0,0,0,0,0,0,0,0,0,0,0,0,fresh,1,0,Pond,Fish,NA,0,0,0,NA,NA,NA,NA,Chordata,Asia,NA,Japan
"Lindh, MV; Riemann, L; Baltar, F; Romero-Oliva, C; Salomon, PS; Graneli, E; Pinhassi, J",Consequences of increased temperature and acidification on bacterioplankton community composition during a mesocosm spring bloom in the Baltic Sea,ENVIRONMENTAL MICROBIOLOGY REPORTS,DNA,1,0,2013,0.75,<0.22,Polysulfone,PCI,16S,1,0,0,0,0,0,0,0,0,0,0,0,0,0,0,0,0,0,0,0,0,0,0,0,0,0,0,marine,0,1,Coastal Ocean,Bacteria,OTU,0,1,0,17,NA,NA,NA,"Bacteriodetes, Proteobacteria, Cyanophyta",Europe,Baltic Sea,Sweden
"Jezbera, J; Jezberova, J; Kasalicky, V; Simek, K; Hahn, MW",Patterns of Limnohabitans Microdiversity across a Large Set of Freshwater Habitats as Revealed by Reverse Line Blot Hybridization,PLOS ONE,DNA,1,0,2013,0.35,<0.22,NA,PCI,"16S, 23S",1,0,1,0,0,0,0,0,0,0,0,0,0,0,0,0,0,0,0,0,0,0,0,0,0,0,0,fresh,1,0,Lake,Non target,NA,0,0,0,NA,NA,NA,NA,Proteobacteria,Europe,NA,Czech Republic
"Bradford, TM; Morgan, MJ; Lorenz, Z; Hartley, DM; Hardy, CM; Oliver, RL",Microeukaryote community composition assessed by pyrosequencing is associated with light availability and phytoplankton primary production along a lowland river,FRESHWATER BIOLOGY,DNA,1,0,2013,15,<0.22,Glass_Fiber,QPS_Kit,18S,0,1,0,0,0,0,0,0,0,0,0,0,0,0,0,0,0,0,0,0,0,0,0,0,0,0,0,fresh,1,0,River,Non target,OTU,0,1,0,329.68,NA,NA,NA,>10,Oceania,NA,Australia
"Kelly, RP; Port, JA; Yamahara, KM; Crowder, LB",Using Environmental DNA to Census Marine Fishes in a Large Mesocosm,PLOS ONE,DNA,1,0,2014,1,<0.22,Polysulfone,QBT_Kit,12S,0,0,0,0,0,0,0,0,0,0,1,0,0,0,0,0,0,0,0,0,0,0,0,0,0,0,0,marine,0,1,Aquarium,Fish,Species,0,0,1,NA,NA,23,NA,Chordata,North America,Northeast Pacific,USA
"Barberan, A; Casamayor, EO","A phylogenetic perspective on species diversity, beta-diversity and biogeography for the microbial world",MOLECULAR ECOLOGY,DNA,1,0,2014,0.25,<0.22,Polycarbonate,PCI,16S,1,0,0,0,0,0,0,0,0,0,0,0,0,0,0,0,0,0,0,0,0,0,0,0,0,0,0,fresh,1,0,Lake,Non target,NA,0,0,0,NA,NA,NA,NA,"Proteobacteria, Bacteroidetes, Actinobacteria",Europe,NA,Spain
"Xiao, X; Sogge, H; Lagesen, K; Tooming-Klunderud, A; Jakobsen, KS; Rohrlack, T",Use of High Throughput Sequencing and Light Microscopy Show Contrasting Results in a Study of Phytoplankton Occurrence in a Freshwater Environment,PLOS ONE,DNA,1,0,2014,1,0.4_1,Cellulose_Acetate,NA,"16S, 18S",1,1,0,0,0,0,0,0,0,0,0,0,0,0,0,0,0,0,0,0,0,0,0,0,0,0,0,fresh,1,0,Lake,Phytoplankton,OTU,0,1,0,"2,240",NA,NA,NA,>10,Europe,NA,Norway
"Hartikainen, H; Ashford, OS; Berney, C; Okamura, B; Feist, SW; Baker-Austin, C; Stentiford, GD; Bass, D",Lineage-specific molecular probing reveals novel diversity and ecological partitioning of haplosporidians,ISME JOURNAL,DNA,1,0,2014,150,0.4_1,Polycarbonate,QUS_Kit,18S,0,1,0,0,0,0,0,0,0,0,0,0,0,0,0,0,0,0,0,0,0,0,0,0,0,0,0,marine,0,1,Channel,Parasite,OTU,0,1,0,49,NA,NA,NA,Cercozoa,Europe,Northeast Atlantic,UK
"Miya, M; Sato, Y; Fukunaga, T; Sado, T; Poulsen, JY; Sato, K; Minamoto, T; Yamamoto, S; Yamanaka, H; Araki, H; Kondoh, M; Iwasaki, W","MiFish, a set of universal PCR primers for metabarcoding environmental DNA from fishes: detection of more than 230 subtropical marine species",ROYAL SOCIETY OPEN SCIENCE,DNA,1,0,2015,10,0.4_1,Glass_Fiber,QBT_Kit,12S,0,0,0,0,0,0,0,0,0,0,1,0,0,0,0,0,0,0,0,0,0,0,0,0,0,0,0,"fresh, marine",1,1,"Coral reef, Aquarium",Fish,Species,0,0,1,NA,NA,232,NA,Chordata,Asia,Northwest Pacific,Japan
"McCarthy, A; Chiang, E; Schmidt, ML; Denef, VJ",RNA Preservation Agents and Nucleic Acid Extraction Method Bias Perceived Bacterial Community Composition,PLOS ONE,DNA,1,0,2015,10,<0.22,Polyethersulfone,QAP_Kit,16S,1,0,0,0,0,0,0,0,0,0,0,0,0,0,0,0,0,0,0,0,0,0,0,0,0,0,0,fresh,1,0,"Lake, River",Bacteria,OTU,0,1,0,89,NA,NA,NA,>10,North America,NA,USA
"Mohiuddin, M; Schellhorn, HE",Spatial and temporal dynamics of virus occurrence in two freshwater lakes captured through metagenomic analysis,FRONTIERS IN MICROBIOLOGY,DNA,1,0,2015,0.1,<0.22,Polyethersulfone,NBD_Kit,Genomic,0,0,0,0,0,0,0,0,0,0,0,0,0,0,0,0,0,0,0,0,0,0,0,0,0,1,0,fresh,1,0,Lake,Virus,NA,0,0,0,NA,NA,NA,NA,NA,North America,NA,Canada
"Port, JA; O'Donnell, JL; Romero-Maraccini, OC; Leary, PR; Litvin, SY; Nickols, KJ; Yamahara, KM; Kelly, RP",Assessing vertebrate biodiversity in a kelp forest ecosystem using environmental DNA,MOLECULAR ECOLOGY,DNA,1,0,2016,3,<0.22,Polysulfone,QPW_Kit,12S,0,0,0,0,0,0,0,0,0,0,1,0,0,0,0,0,0,0,0,0,0,0,0,0,0,0,0,marine,0,1,Kelp forest,Non target,OTU,0,1,0,33,NA,NA ,NA,Chordata,North America,Northeast Pacific,USA
"Civade, R; Dejean, T; Valentini, A; Roset, N; Raymond, JC; Bonin, A; Taberlet, P; Pont, D",Spatial Representativeness of Environmental DNA Metabarcoding Signal for Fish Biodiversity Assessment in a Natural Freshwater System,PLOS ONE,DNA,1,0,2016,45,0.4_1,Polyester,QBT_Kit,12S,0,0,0,0,0,0,0,0,0,0,1,0,0,0,0,0,0,0,0,0,0,0,0,0,0,0,0,fresh,1,0,River,Fish,Species,0,0,1,NA,NA,21,NA,Chordata,Europe,NA,France
"Thomsen, PF; Moller, PR; Sigsgaard, EE; Knudsen, SW; Jorgensen, OA; Willerslev, E","Environmental DNA from Seawater Samples Correlate with Trawl Catches of Subarctic, Deepwater Fishes",PLOS ONE,DNA,1,0,2016,1.5,0.4_1,Nylon,QBT_Kit_alt,12S,0,0,0,0,0,0,0,0,0,0,1,0,0,0,0,0,0,0,0,0,0,0,0,0,0,0,0,marine,0,1,Deep Ocean,Fish,Species,0,0,1,NA,NA,NA ,37,Chordata,North America,Arctic Ocean,Greenland
"Shaw, JLA; Clarke, LJ; Wedderburn, SD; Barnes, TC; Weyrich, LS; Cooper, A",Comparison of environmental DNA metabarcoding and conventional fish survey methods in a river system,BIOLOGICAL CONSERVATION,DNA,1,0,2016,1,0.4_1,Nitrocellulose,QPW_Kit,"12S, 16S",1,0,0,0,0,0,0,0,0,0,1,0,0,0,0,0,0,0,0,0,0,0,0,0,0,0,0,fresh,1,0,River,Fish,Species,0,0,1,NA,NA,8,NA,Chordata,Oceania,NA,Australia
"Olds, BP; Jerde, CL; Renshaw, MA; Li, YY; Evans, NT; Turner, CR; Deiner, K; Mahon, AR; Brueseke, MA; Shirey, PD; Pfrender, ME; Lodge, DM; Lamberti, GA",Estimating species richness using environmental DNA,ECOLOGY AND EVOLUTION,DNA,1,0,2016,0.25,>1,Polycarbonate,PCI,"12S, 16S, cytb",1,0,0,0,0,0,1,0,0,0,1,0,0,0,0,0,0,0,0,0,0,0,0,0,0,0,0,fresh,1,0,River,Fish,Species,0,0,1,NA,NA,16,NA,Chordata,North America,NA,USA
"Hanfling, B; Handley, LL; Read, DS; Hahn, C; Li, JL; Nichols, P; Blackman, RC; Oliver, A; Winfield, IJ",Environmental DNA metabarcoding of lake fish communities reflects long-term data from established survey methods,MOLECULAR ECOLOGY,DNA,1,0,2016,2,0.4_1,Cellulose_Nitrate,QPW_Kit,"12S, cytb",0,0,0,0,0,0,1,0,0,0,1,0,0,0,0,0,0,0,0,0,0,0,0,0,0,0,0,fresh,1,0,Lake,Fish,Species,0,0,1,NA,NA,14,NA,Chordata,Europe,NA,UK
"Denef, VJ; Mueller, RS; Chiang, EN; Liebig, JR; Vanderploeg, HA",Chloroflexi CL500-11 Populations That Predominate Deep-Lake Hypolimnion Bacterioplankton Rely on Nitrogen-Rich Dissolved Organic Matter Metabolism and C-1 Compound Oxidation,APPLIED AND ENVIRONMENTAL MICROBIOLOGY,DNA,1,0,2016,30,<0.22,Membrane,QAP_Kit,16S,1,0,0,0,0,0,0,0,0,0,0,0,0,0,0,0,0,0,0,0,0,0,0,0,0,0,0,fresh,1,0,Lake,Bacteria,NA,0,0,0,NA,NA,NA ,NA,NA,North America,NA,USA
"Osterholz, H; Singer, G; Wemheuer, B; Daniel, R; Simon, M; Niggemann, J; Dittmar, T",Deciphering associations between dissolved organic molecules and bacterial communities in a pelagic marine system,ISME JOURNAL,DNA,1,0,2016,10,<0.22,"Glass_Fiber, Polycarbonate",PCI,16S,1,0,0,0,0,0,0,0,0,0,0,0,0,0,0,0,0,0,0,0,0,0,0,0,0,0,0,marine,0,1,Coastal Ocean,Bacteria,OTU,0,1,0,526,NA,NA ,NA,"Proteobacteria, Verrucomicrobia, Flavobacteria, Cyanophyta",Europe,Northeast Atlantic,Germany
"Kelly, RP; O'Donnell, JL; Lowell, NC; Shelton, AO; Samhouri, JF; Hennessey, SM; Feist, BE; Williams, GD",Genetic signatures of ecological diversity along an urbanization gradient,PEERJ,DNA,1,0,2016,1,0.4_1,Cellulose,PCI,16S,1,0,0,0,0,0,0,0,0,0,0,0,0,0,0,0,0,0,0,0,0,0,0,0,0,0,0,marine,0,1,Open Ocean,Non target,OTU,0,1,0,"1,664",NA,NA ,NA,"Mollusca, Arthropoda, Chordata, Bryozoa, Echinodermata, Nemertea, Hemichordata, Entoprocta, Porifera",North America,Northeast Pacific,USA
"Hartikainen, H; Bass, D; Briscoe, AG; Knipe, H; Green, AJ; Okamura, B",Assessing myxozoan presence and diversity using environmental DNA,INTERNATIONAL JOURNAL FOR PARASITOLOGY,DNA,1,0,2016,25,0.4_1,NA,QPS_Kit,16S,1,0,0,0,0,0,0,0,0,0,0,0,0,0,0,0,0,0,0,0,0,0,0,0,0,0,0,fresh,1,0,"Pond, River, Lake",Invertebrate,OTU,0,1,0,112,NA,NA ,NA,Cnidaria,Europe,NA,UK
"Abad, D; Albaina, A; Aguirre, M; Laza-Martinez, A; Uriarte, I; Iriarte, A; Villate, F; Estonba, A",Is metabarcoding suitable for estuarine plankton monitoring? A comparative study with microscopy,MARINE BIOLOGY,DNA,1,0,2016,1,<0.22,Membrane,QPS_Kit,18S,0,1,0,0,0,0,0,0,0,0,0,0,0,0,0,0,0,0,0,0,0,0,0,0,0,0,0,marine,0,1,Estuary,Non target,OTU,0,1,0,831,NA,NA ,NA,>10,Europe,Northeast Atlantic,Spain
"Keskin, E; Unal, EM; Atar, HH",Detection of rare and invasive freshwater fish species using eDNA pyrosequencirig: Lake Iznik ichthyofauna revised,BIOCHEMICAL SYSTEMATICS AND ECOLOGY,DNA,1,0,2016,1.5,<0.22,Cellulose_Nitrate,CGM_Kit,cytb,0,0,0,0,0,0,1,0,0,0,0,0,0,0,0,0,0,0,0,0,0,0,0,0,0,0,0,fresh,1,0,Lake,Fish,Species,0,0,1,NA,NA,23,NA,Chordata,Asia,NA,Turkey
"Andruszkiewicz, EA; Sassoubre, LM; Boehm, AB",Persistence of marine fish environmental DNA and the influence of sunlight,PLOS ONE,DNA,1,0,2017,0.5,<0.22,Polycarbonate,QBT_Kit_alt,12S,0,0,0,0,0,0,0,0,0,0,1,0,0,0,0,0,0,0,0,0,0,0,0,0,0,0,0,marine,0,1,Aquarium,Fish,OTU,0,1,0,190,NA,NA ,NA,Chordata,North America,Northeast Pacific,USA
"Andruszkiewicz, EA; Starks, HA; Chavez, FP; Sassoubre, LM; Block, BA; Boehm, AB",Biomonitoring of marine vertebrates in Monterey Bay using eDNA metabarcoding,PLOS ONE,DNA,1,0,2017,1,<0.22,Polyvinylidene_fluoride,QBT_Kit_alt,12S,0,0,0,0,0,0,0,0,0,0,1,0,0,0,0,0,0,0,0,0,0,0,0,0,0,0,0,marine,0,1,"Coastal Ocean, Deep Ocean",Fish,OTU,0,1,0,"1,165",NA,NA ,NA,Chordata,North America,Northeast Pacific,USA
"Yamamoto, S; Masuda, R; Sato, Y; Sado, T; Araki, H; Kondoh, M; Minamoto, T; Miya, M",Environmental DNA metabarcoding reveals local fish communities in a species-rich coastal sea,SCIENTIFIC REPORTS,DNA,1,0,2017,1,0.4_1,Glass_Fiber,QBT_Kit_alt,12S,0,0,0,0,0,0,0,0,0,0,1,0,0,0,0,0,0,0,0,0,0,0,0,0,0,0,0,marine,0,1,Bay,Fish,"OTU, Species",0,1,1,128,NA,112,NA,Chordata,Asia,Northwest Pacific,Japan
"Sasso, T; Lopes, CM; Valentini, A; Dejean, T; Zarnudio, KR; Haddad, CFB; Martins, M",Environmental DNA characterization of amphibian communities in the Brazilian Atlantic forest: Potential application for conservation of a rich and threatened fauna,BIOLOGICAL CONSERVATION,DNA,1,0,2017,60,>1,Polyester,QBT_Kit,12S,0,0,0,0,0,0,0,0,0,0,1,0,0,0,0,0,0,0,0,0,0,0,0,0,0,0,0,fresh,1,0,River,Amphibian,Species,0,0,1,NA,NA,19,NA,Chordata,SOTUh America,NA,Brazil
"Sigsgaard, EE; Nielsen, IB; Carl, H; Krag, MA; Knudsen, SW; Xing, YC; Holm-Hansen, TH; Moller, PR; Thomsen, PF",Seawater environmental DNA reflects seasonality of a coastal fish community,MARINE BIOLOGY,DNA,1,0,2017,0.5,<0.22,Polyethersulfone,QBT_Kit_alt,12S,0,0,0,0,0,0,0,0,0,0,1,0,0,0,0,0,0,0,0,0,0,0,0,0,0,0,0,marine,0,1,Coastal Ocean,Fish,Species,0,0,1,NA,NA,29,NA,Chordata,Europe,Northeast Atlantic,Denmark
"Sato, H; Sogo, Y; Doi, H; Yamanaka, H",Usefulness and limitations of sample pooling for environmental DNA metabarcoding of freshwater fish communities,SCIENTIFIC REPORTS,DNA,1,0,2017,0.375,0.4_1,Glass_Fiber,QBT_Kit_alt,12S,0,0,0,0,0,0,0,0,0,0,1,0,0,0,0,0,0,0,0,0,0,0,0,0,0,0,0,fresh,1,0,Lake,Fish,Species,0,0,1,NA,NA,43,NA,Chordata,Asia,NA,Japan
"Stat, M; Huggett, MJ; Bernasconi, R; DiBattista, JD; Berry, TE; Newman, SJ; Harvey, ES; Bunce, M",Ecosystem biomonitoring with eDNA: metabarcoding across the tree of life in a tropical marine environment,SCIENTIFIC REPORTS,DNA,1,0,2017,1,<0.22,Nylon,QBT_Kit,"12S, 16S, 18S, 28S, COI, cytb",1,1,0,1,0,0,1,1,0,0,1,0,0,0,0,0,0,0,0,0,0,0,0,0,0,0,0,marine,0,1,Coral reef,Non target,OTU,0,1,0,879,NA,NA,NA,>10,Oceania,Indian Ocean,Australia
"Tessler, M; Brugler, MR; DeSalle, R; Hersch, R; Velho, LFM; Segovia, BT; Lansac-Toha, FA; Lemke, MJ",A Global eDNA Comparison of Freshwater Bacterioplankton Assemblages Focusing on Large-River Floodplain Lakes of Brazil,MICROBIAL ECOLOGY,DNA,1,0,2017,NA,<0.22,Polycarbonate,MPFD_kit,16S,1,0,0,0,0,0,0,0,0,0,0,0,0,0,0,0,0,0,0,0,0,0,0,0,0,0,0,fresh,1,0,River,Bacteria,NA,0,0,0,NA,NA,NA,NA,"Verrucomicrobia, Proteobacteria, Cyanophyta, Bacteriodetes, Actinobacteria",SOTUh America,NA,Brazil
"Hirai, M; Nishi, S; Tsuda, M; Sunamura, M; Takaki, Y; Nunoura, T",Library Construction from Subnanogram DNA for Pelagic Sea Water and Deep-Sea Sediments,MICROBES AND ENVIRONMENTS,DNA,1,0,2017,3.5,<0.22,Cellulose,QPS_Kit,16S,1,0,0,0,0,0,0,0,0,0,0,0,0,0,0,0,0,0,0,0,0,0,0,0,0,0,0,marine,0,1,Open Ocean,Bacteria,NA,0,0,0,NA,NA,NA,NA,>10,Asia,Northwest Pacific,Japan
"Manrique, JM; Jones, LR","Are ocean currents to slow to counteract SAR11 evolution? A next-generation sequencing, phylogeographic analysis",MOLECULAR PHYLOGENETICS AND EVOLUTION,DNA,1,0,2017,3,<0.22,Polycarbonate,CTAB,16S,1,0,0,0,0,0,0,0,0,0,0,0,0,0,0,0,0,0,0,0,0,0,0,0,0,0,0,marine,0,1,Open Ocean,Bacteria,OTU,0,1,0,276,NA,NA,NA,Bacterial,SOTUh America,SOTUhwest Atlantic,Argentina
"Klymus, KE; Marshall, NT; Stepien, CA",Environmental DNA (eDNA) metabarcoding assays to detect invasive invertebrate species in the Great Lakes,PLOS ONE,DNA,1,0,2017,0.4,<0.22,Polyethersulfone,CTAB,16S,1,0,0,0,0,0,0,0,0,0,0,0,0,0,0,0,0,0,0,0,0,0,0,0,0,0,0,fresh,1,0,River,Non target,OTU,0,1,0,24,NA,NA,NA,Mollusca,North America,NA,USA
"O'Donnell, JL; Kelly, RP; Shelton, AO; Samhouri, JF; Lowell, NC; Williams, GD",Spatial distribution of environmental DNA in a nearshore marine habitat,PEERJ,DNA,1,0,2017,1,0.4_1,Cellulose,PCI,16S,1,0,0,0,0,0,0,0,0,0,0,0,0,0,0,0,0,0,0,0,0,0,0,0,0,0,0,marine,0,1,Bay,Non target,OTU,0,1,0,136,NA,NA ,NA,NA,North America,Northeast Pacific,USA
"Canelhas, MR; Andersson, M; Eiler, A; Lindstrom, ES; Bertilsson, S",Influence of pulsed and continuous substrate inputs on freshwater bacterial community composition and functioning in bioreactors,ENVIRONMENTAL MICROBIOLOGY,DNA,1,0,2017,0.01,<0.22,Polyethersulfone,QPS_Kit,16S,1,0,0,0,0,0,0,0,0,0,0,0,0,0,0,0,0,0,0,0,0,0,0,0,0,0,0,fresh,1,0,Lake,Bacteria,OTU,0,1,0,112,NA,NA,NA,NA,Europe,NA,Sweden
"Won, NI; Kim, KH; Kang, JH; Park, SR; Lee, HJ",Exploring the Impacts of Anthropogenic Disturbance on Seawater and Sediment Microbial Communities in Korean Coastal Waters Using Metagenomics Analysis,INTERNATIONAL JOURNAL OF ENVIRONMENTAL RESEARCH AND PUBLIC HEALTH,DNA,1,0,2017,20,<0.22,Cellulose_Nitrate,"QPW_Kit, MPFD_kit",16S,1,0,0,0,0,0,0,0,0,0,0,0,0,0,0,0,0,0,0,0,0,0,0,0,0,0,0,marine,0,1,Open Ocean,Bacteria,OTU,0,1,0,"6,828",NA,NA,NA,"Proteobacteria, Bacteriodetes, Actinobacteria, Cyanophyta, Euryarchaeota, Verrucomicrobia",Asia,Northwest Pacific,SOTUh Korea
"DiBattista, JD; Coker, DJ; Sinclair-Taylor, TH; Stat, M; Berumen, ML; Bunce, M",Assessing the utility of eDNA as a tool to survey reef-fish communities in the Red Sea,CORAL REEFS,DNA,1,0,2017,0.5,0.4_1,Micronylon,QBT_Kit_alt,16S,1,0,0,0,0,0,0,0,0,0,0,0,0,0,0,0,0,0,0,0,0,0,0,0,0,0,0,marine,0,1,Coral reef,Fish,Species,0,0,1,NA,NA,46,NA,Chordata,Asia,Indian Ocean,Saudi Arabia
"Flaviani, F; Schroeder, DC; Balestreri, C; Schroeder, JL; Moore, K; Paszkiewicz, K; Pfaff, MC; Rybicki, EP",A Pelagic Microbiome (Viruses to Protists) from a Small Cup of Seawater,VIRUSES-BASEL,DNA,1,0,2017,0.25,0.4_1,Polycarbonate,QBT_Kit,"16S, 18S",1,1,0,0,0,0,0,0,0,0,0,0,0,0,0,0,0,0,0,0,0,0,0,0,0,0,0,marine,0,1,Open Ocean,Bacteria,OTU,0,1,0,"1,886",NA,NA,NA,>10,Africa,Indian Ocean,SOTUh Africa
