authors,title,source,DNA_RNA,DNA,RNA,year,volume_l,filter_size_µm,filter_type,DNA_extr,loci,16S,18S,23S,28S,ITS2,ITS1,cytb,CO1,NADH4,D-loop,12S,rbcL,rrnA,arrA,cbbL,nifH,aprA,rpoC1,pufM,luxA,amoA,mutS,phnD,LSU rDNA,tufA,genome,transcriptome,water,fresh,marine,system,type_organism,id_type,ASV,OTU,Species,max_OTUs,max_ASV,max_spp,max_spp_other,phylum,continent,region,country
"Menning, D; Simmons, T; Talbot, S",Using redundant primer sets to detect multiple native Alaskan fish species from environmental DNA,CONSERVATION GENETICS RESOURCES,DNA,1,0,2020,2,0.4_1,Cellulose_Acetate,QBT_Kit,"12S, 16S, COI",1,0,0,0,0,0,0,1,0,0,1,0,0,0,0,0,0,0,0,0,0,0,0,0,0,0,0,fresh,1,0,Lake,Fish,NA,0,0,0,NA,NA,NA,NA,Chordata,North America,NA,USA
"Juottonen, H; Fontaine, L; Wurzbacher, C; Drakare, S; Peura, S; Eiler, A","Archaea in boreal Swedish lakes are diverse, dominated by Woesearchaeota and follow deterministic community assembly",ENVIRONMENTAL MICROBIOLOGY,DNA,1,0,2020,0.3,<0.22,Polycarbonate,QPS_Kit,16S,1,0,0,0,0,0,0,0,0,0,0,0,0,0,0,0,0,0,0,0,0,0,0,0,0,0,0,fresh,1,0,Lake,Achaea,ASV,1,0,0,NA,"119,483",NA,NA,NA,Europe,NA,Sweden
"Noyer, M; Reoyo-Prats, B; Aubert, D; Bernard, M; Verneau, O; Palacios, C",Particle -attached riverine bacteriome shifts in a pollutant -resistant and pathogenic community during a Mediterranean extreme storm event,SCIENCE OF THE TOTAL ENVIRONMENT,DNA,1,0,2020,1,<0.22,Cellulose_Acetate,QAP_Kit,16S,1,0,0,0,0,0,0,0,0,0,0,0,0,0,0,0,0,0,0,0,0,0,0,0,0,0,0,fresh,1,0,River,Bacteria,OTU,0,1,0,"9,211",NA,NA,NA,NA,Europe,NA,France
"Schmidt, ML; Biddanda, BA; Weinke, AD; Chiang, E; Januska, F; Props, R; Denef, VJ",Microhabitats are associated with diversity-productivity relationships in freshwater bacterial communities,FEMS MICROBIOLOGY ECOLOGY,DNA,1,0,2020,1.5,<0.22,Polyethersulfone,QAP_Kit,16S,1,0,0,0,0,0,0,0,0,0,0,0,0,0,0,0,0,0,0,0,0,0,0,0,0,0,0,fresh,1,0,Lake,Non target,OTU,0,1,0,"2,979",NA,NA,NA,NA,North America,NA,USA
"Calheiros, CSC; Carecho, J; Tomasino, MP; Almeida, CMR; Mucha, AP",Floating Wetland Islands Implementation and Biodiversity Assessment in a Port Marina,WATER,DNA,1,0,2020,5,<0.22,Polyethersulfone,QPW_Kit,16S,1,0,0,0,0,0,0,0,0,0,0,0,0,0,0,0,0,0,0,0,0,0,0,0,0,0,0,marine,0,1,Coastal Ocean,Bacteria,OTU,0,1,0,NA,NA,NA,NA,"Proteobacteria, Bacteriodetes, Actinobacteria, Cyanophyta, Planctomycetes, Firmicutes, Acidobacteria, Spirochaetes, Chloroflexi",Europe,Northeast Atlantic,Portugal
"Ghosh, A; Debnath, M; Bhadury, P",Datasets of surface water microbial populations from two anthropogenically impacted sites on the Bhagirathi-Hooghly River,DATA IN BRIEF,DNA,1,0,2020,1,<0.22,Cellulose_Nitrate,QBT_Kit,"16S, 18S",1,1,0,0,0,0,0,0,0,0,0,0,0,0,0,0,0,0,0,0,0,0,0,0,0,0,0,fresh,1,0,River,Non target,OTU,0,1,0,"42,563",NA,NA,NA,NA,Asia,NA,India
"Zhang, Y; Pavlovska, M; Stoica, E; Prekrasna, I; Yang, JH; Slobodnik, J; Zhang, XW; Dykyi, E",Holistic pelagic biodiversity monitoring of the Black Sea via eDNA metabarcoding approach: From bacteria to marine mammals,ENVIRONMENT INTERNATIONAL,DNA,1,0,2020,2.5,<0.22,Polyethersulfone,QPS_Kit_alt,"16S, 18S, 12S",1,1,0,0,0,0,0,0,0,0,1,0,0,0,0,0,0,0,0,0,0,0,0,0,0,0,0,marine,0,1,"Coastal Ocean, Open Ocean",Non target,"OTU, Species",0,1,1,"8,900",NA,630,NA,NA,Europe,Black Sea,Ukraine
"Djurhuus, A; Closek, CJ; Kelly, RP; Pitz, KJ; Michisaki, RP; Starks, HA; Walz, KR; Andruszkiewicz, EA; Olesin, E; Hubbard, K; Montes, E; Otis, D; Muller-Karger, FE; Chavez, FP; Boehm, AB; Breitbart, M",Environmental DNA reveals seasonal shifts and potential interactions in a marine community,NATURE COMMUNICATIONS,DNA,1,0,2020,1,<0.22,Polyvinylidene_difluoride,QBT_Kit,"16S, 18S, 12S, COI",1,1,0,0,0,0,0,1,0,0,1,0,0,0,0,0,0,0,0,0,0,0,0,0,0,0,0,marine,0,1,Bay,Non target,Species,0,0,1,NA,NA,663,NA,NA,North America,Northeast Pacific,USA
"Westfall, KM; Therriault, TW; Abbott, CL",A new approach to molecular biosurveillance of invasive species using DNA metabarcoding,GLOBAL CHANGE BIOLOGY,DNA,1,0,2020,2,>1,Cellulose_Nitrate,QBT_Kit,"16S, 18S, COI, ND4",1,1,0,0,0,0,0,1,1,0,0,0,0,0,0,0,0,0,0,0,0,0,0,0,0,0,0,marine,0,1,Bay,Non target,Species,0,0,1,NA,NA,96,NA,"Annelida, Arthropoda, Bryozoa, Ascidiacea, Cnidaria, Mollusca, Nemertea",North America,"Northeast Pacific, Northwest Atlantic",Canada
"West, KM; Stat, M; Harvey, ES; Skepper, CL; DiBattista, JD; Richards, ZT; Travers, MJ; Newman, SJ; Bunce, M","eDNA metabarcoding survey reveals fine-scale coral reef community variation across a remote, tropical island ecosystem",MOLECULAR ECOLOGY,DNA,1,0,2020,1,<0.22,Polyethersulfone,QBT_Kit,"16S, COI, 18S",1,1,0,0,0,0,0,1,0,0,0,0,0,0,0,0,0,0,0,0,0,0,0,0,0,0,0,marine,0,1,Coral reef,Non target,Species,0,0,1,NA,NA,372,NA,"Chordata, Mollusca, Echinodermata, Arthropoda",Oceania,Indian Ocean,Australia
"Huhn, M; Madduppa, HH; Khair, M; Sabrian, A; Irawati, Y; Anggraini, NP; Wilkinson, SP; Simpson, T; Iwasaki, K; Setiamarga, DHE; Dias, PJ","Keeping up with introduced marine species at a remote biodiversity hotspot: awareness, training and collaboration across different sectors is key",BIOLOGICAL INVASIONS,DNA,1,0,2020,0.5,0.4_1,Cellulose_Nitrate,QBT_Kit,"16S, ITS2, 18S",1,1,0,0,1,0,0,0,0,0,0,0,0,0,0,0,0,0,0,0,0,0,0,0,0,0,0,marine,0,1,"Bay, Coral reef",Non target,OTU,0,1,0,"14,319",NA,NA,NA,NA,Asia,Indo-Pacific,Indonesia
"Laroche, O; Kersten, O; Smith, CR; Goetze, E",From Sea Surface to Seafloor: A Benthic Allochthonous eDNA Survey for the Abyssal Ocean,MOLECULAR ECOLOGY,DNA,1,0,2020,3,<0.22,Polyethersulfone,NA,18S,0,1,0,0,0,0,0,0,0,0,0,0,0,0,0,0,0,0,0,0,0,0,0,0,0,0,0,marine,0,1,Deep Ocean,Non target,ASV,1,0,0,NA,"5,953",NA,NA,NA,NA,North Pacific,NA
"Easson, CG; Boswell, KM; Tucker, N; Warren, JD; Lopez, JV",Combined eDNA and Acoustic Analysis Reflects Diel Vertical Migration of Mixed Consortia in the Gulf of Mexico,FRONTIERS IN MARINE SCIENCE,DNA,1,0,2020,2,0.4_1,Cellulose_Nitrate,QPS_Kit,18S,0,1,0,0,0,0,0,0,0,0,0,0,0,0,0,0,0,0,0,0,0,0,0,0,0,0,0,marine,0,1,Open Ocean,Non target,ASV,1,0,0,NA,"10,185",NA,NA,"Annelida, Arthropoda, Hydrozoa, Ctenophora, Chordata, Tunicata",North America,Northwest Atlantic,USA
"von Ammon, U; Jeffs, A; Zaiko, A; van der Reis, A; Goodwin, D; Beckley, LE; Malpot, E; Pochon, X",A Portable Cruising Speed Net: Expanding Global Collection of Sea Surface Plankton Data,FRONTIERS IN MARINE SCIENCE,DNA,1,0,2020,0.2,>1,NA,ZRMP_Kit,18S,0,1,0,0,0,0,0,0,0,0,0,0,0,0,0,0,0,0,0,0,0,0,0,0,0,0,0,marine,0,1,"Coastal Ocean, Open Ocean",Non target,"ASV, Species",1,0,1,NA,"2,839",379,NA,NA,Oceania,"Indo-Pacific, SOTUhwest Pacific","New Zeland, Australia"
"Darling, JA; Martinson, J; Lohan, KMP; Carney, KJ; Pilgrim, E; Banerji, A; Holzer, KK; Rui, GM",Metabarcoding quantifies differences in accumulation of ballast water borne biodiversity among three port systems in the United States,SCIENCE OF THE TOTAL ENVIRONMENT,DNA,1,0,2020,0.125,0.4_1,Polycarbonate,PCI,18S,0,1,0,0,0,0,0,0,0,0,0,0,0,0,0,0,0,0,0,0,0,0,0,0,0,0,0,marine,0,1,Coastal Ocean,Non target,OTU,0,1,0,"1,144",NA,NA,NA,NA,North America,Northwest Atlantic,USA
"Chen, TT; Liu, Y; Xu, S; Song, SQ; Li, CW",Variation of Amoebophrya community during bloom of Prorocentrum donghaiense Lu in coastal waters of the East China Sea,ESTUARINE COASTAL AND SHELF SCIENCE,DNA,1,0,2020,1,>1,Polycarbonate,QPS_Kit,18S,0,1,0,0,0,0,0,0,0,0,0,0,0,0,0,0,0,0,0,0,0,0,0,0,0,0,0,marine,0,1,Bay,Phytoplankton,OTU,0,1,0,"1,086",NA,NA,NA,Dinoflagellata,Asia,Northwest Pacific,China
"Laroche, O; Kersten, O; Smith, CR; Goetze, E",Environmental DNA surveys detect distinct metazoan communities across abyssal plains and seamounts in the western Clarion Clipperton Zone,FRONTIERS IN MARINE SCIENCE,DNA,1,0,2020,6,<0.22,Polyethersulfone,QDP_Kit,"18S, COI",0,1,0,0,0,0,0,1,0,0,0,0,0,0,0,0,0,0,0,0,0,0,0,0,0,0,0,marine,0,1,Deep Ocean,Non target,ASV,1,0,0,NA,"2,020_18s, 11,901_COI",NA,NA,NA,NA,North Pacific,NA
"Rey, A; Basurko, OC; Rodriguez-Ezpeleta, N",Considerations for metabarcoding-based port biological baseline surveys aimed at marine nonindigenous species monitoring and risk assessments,ECOLOGY AND EVOLUTION,DNA,1,0,2020,3,0.4_1,Polyethersulfone,QBT_Kit,"18S, COI",0,1,0,0,0,0,0,1,0,0,0,0,0,0,0,0,0,0,0,0,0,0,0,0,0,0,0,marine,0,1,Coastal Ocean,Non target,OTU,0,1,0,580,NA,NA,NA,NA,Europe,Northeast Atlantic,Spain
"DiBattista, JD; Reimer, JD; Stat, M; Masucci, GD; Biondi, P; De Brauwer, M; Wilkinson, SP; Chariton, AA; Bunce, M",Environmental DNA can act as a biodiversity barometer of anthropogenic pressures in coastal ecosystems,SCIENTIFIC REPORTS,DNA,1,0,2020,0.75,<0.22,Polyethersulfone,QBT_Kit,"18S, ITS2",0,1,0,0,1,0,0,0,0,0,0,0,0,0,0,0,0,0,0,0,0,0,0,0,0,0,0,marine,0,1,Coral reef,Non target,OTU,0,1,0,498,NA,NA,NA,NA,Asia,Northwest Pacific,Japan
"Jacobs-Palmer, E; Gallego, R; Ramon-Laca, A; Kunselman, E; Cribari, K; Horwith, M; Kelly, RP",A halo of reduced dinoflagellate abundances in and around eelgrass beds,PEERJ,DNA,1,0,2020,0.5,0.4_1,Cellulose_Acetate,PCI,COI,0,0,0,0,0,0,0,1,0,0,0,0,0,0,0,0,0,0,0,0,0,0,0,0,0,0,0,marine,0,1,Estuary,Non target,ASV,1,0,0,NA,"3,000",NA,NA,>10,North America,Northeast Pacific,USA
"Gallego, R; Jacobs-Palmer, E; Cribari, K; Kelly, RP",Environmental DNA metabarcoding reveals winners and losers of global change in coastal waters,PROCEEDINGS OF THE ROYAL SOCIETY B-BIOLOGICAL SCIENCES,DNA,1,0,2020,1,0.4_1,Cellulose,PCI_alt,COI,0,0,0,0,0,0,0,1,0,0,0,0,0,0,0,0,0,0,0,0,0,0,0,0,0,0,0,marine,0,1,Coastal Ocean,Non target,ASV,1,0,0,NA,"4,849",NA,NA,NA,North America,Northeast Pacific,USA
"Nguyen, BN; Shen, EW; Seemann, J; Correa, AMS; O'Donnell, JL; Altieri, AH; Knowlton, N; Crandall, KA; Egan, SP; McMillan, WO; Leray, M",Environmental DNA survey captures patterns of fish and invertebrate diversity across a tropical seascape,SCIENTIFIC REPORTS,DNA,1,0,2020,1,0.4_1,Cellulose_Nitrate,QPS_Kit_alt,COI,0,0,0,0,0,0,0,1,0,0,0,0,0,0,0,0,0,0,0,0,0,0,0,0,0,0,0,marine,0,1,Bay,Non target,OTU,0,1,0,"8,586",NA,NA,NA,NA,North America,Caribbean,Panama
"Cheang, CC; Lee, BY; Ip, BHY; Yiu, WH; Tsang, LM; Ang, PO",Fish and crustacean biodiversity in an OTUer maritime estuary of the Pearl River Delta revealed by environmental DNA,MARINE POLLUTION BULLETIN,DNA,1,0,2020,1,>1,Glass_Fiber,QAM_Kit,COI,0,0,0,0,0,0,0,1,0,0,0,0,0,0,0,0,0,0,0,0,0,0,0,0,0,0,0,marine,0,1,Estuary,"Fish, Invertebrate",Species,0,0,1,NA,NA,56,NA,"Chordata, Arthropoda",Asia,Northwest Pacific,China
"McClenaghan, B; Fahner, N; Cote, D; Chawarski, J; McCarthy, A; Rajabi, H; Singer, G; Hajibabaei, M",Harnessing the power of eDNA metabarcoding for the detection of deep-sea fishes,PLOS ONE,DNA,1,0,2020,0.875,<0.22,Polyethersulfone,QBT_Kit,"COI, 12S, 18S",0,1,0,0,0,0,0,1,0,0,1,0,0,0,0,0,0,0,0,0,0,0,0,0,0,0,0,marine,0,1,Deep Ocean,Fish,Species,0,0,1,NA,NA,23,NA,Chordata,North America,Northwest Atlantic,Canada
"Carim, KJ; Bean, NJ; Connor, JM; Baker, WP; Jaeger, M; Ruggles, MP; McKelvey, KS; Franklin, TW; Young, MK; Schwartz, MK",Environmental DNA Sampling Informs Fish Eradication Efforts: Case Studies and Lessons Learned,NORTH AMERICAN JOURNAL OF FISHERIES MANAGEMENT,DNA,1,0,2020,5,>1,Glass_Fiber,QBT_Kit_alt,cytb,0,0,0,0,0,0,1,0,0,0,0,0,0,0,0,0,0,0,0,0,0,0,0,0,0,0,0,fresh,1,0,River,Fish,NA,0,0,0,NA,NA,NA,NA,Chordata,North America,NA,USA
"Castaneda, RA; Van Nynatten, A; Crookes, S; Ellender, BR; Heath, DD; MacIsaac, HJ; Mandrak, NE; Weyl, OLF",Detecting Native Freshwater Fishes Using Novel Non-invasive Methods,FRONTIERS IN ENVIRONMENTAL SCIENCE,DNA,1,0,2020,2,>1,Glass_Fiber,QBT_Kit_alt,cytb,0,0,0,0,0,0,1,0,0,0,0,0,0,0,0,0,0,0,0,0,0,0,0,0,0,0,0,fresh,1,0,River,Fish,NA,0,0,0,NA,NA,NA,NA,Chordata,Africa,NA,SOTUh Africa
"Yuan, TM; Zhang, HH; Feng, QL; Wu, XY; Zhang, YX; McCarthy, AJ; Sekar, R",Changes in Fungal Community Structure in Freshwater Canals across a Gradient of Urbanization,WATER,DNA,1,0,2020,0.5,<0.22,Polycarbonate,QPS_Kit,ITS1,0,0,0,0,0,1,0,0,0,0,0,0,0,0,0,0,0,0,0,0,0,0,0,0,0,0,0,fresh,1,0,Channel,Fungus,OTU,0,1,0,"1,796",NA,NA,NA,>10,Asia,NA,China
"Alexander, JB; Bunce, M; White, N; Wilkinson, SP; Adam, AAS; Berry, T; Stat, M; Thomas, L; Newman, SJ; Dugal, L; Richards, ZT",Development of a multi-assay approach for monitoring coral diversity using eDNA metabarcoding,CORAL REEFS,DNA,1,0,2020,1,<0.22,Polyethersulfone,QBT_Kit_alt,"ITS2, 16S",1,0,0,0,1,0,0,0,0,0,0,0,0,0,0,0,0,0,0,0,0,0,0,0,0,0,0,marine,0,1,Coral reef,Non target,OTU,0,1,0,185,NA,NA,NA,Chordata_Arthropoda_Cnidaria_Placoza_Ctenophora_Porifera,Oceania,Indian Ocean,Australia
"Berman, MC; Llames, ME; Minotti, P; Fermani, P; Quiroga, MV; Ferraro, MA; Metz, S; Zagarese, HE",Field evidence supports former experimental claims on the stimulatory effect of glyphosate on picocyanobacteria communities,SCIENCE OF THE TOTAL ENVIRONMENT,DNA,1,0,2020,0.112,<0.22,Polycarbonate,CTAB,phnD,0,0,0,0,0,0,0,0,0,0,0,0,0,0,0,0,0,0,0,0,0,0,1,0,0,0,0,fresh,1,0,Lake,Bacteria,NA,0,0,0,NA,NA,NA,NA,NA,SOTUh America,NA,Argentina
"Euclide, PT; Lor, Y; Spear, MJ; Tajjioui, T; Vander Zanden, J; Larson, WA; Amberg, JJ",Environmental DNA metabarcoding as a tool for biodiversity assessment and monitoring: reconstructing established fish communities of north-temperate lakes and rivers,DIVERSITY AND DISTRIBUTIONS,DNA,1,0,2021,0.05,NA,NA,MMG_Kit,12S,0,0,0,0,0,0,0,0,0,0,1,0,0,0,0,0,0,0,0,0,0,0,0,0,0,0,0,fresh,1,0,Lake,Fish,ASV,1,0,0,NA,267,NA,NA,Chordata,North America,NA,USA
"Gold, Z; Sprague, J; Kushner, DJ; Marin, EZ; Barber, PH",eDNA metabarcoding as a biomonitoring tool for marine protected areas,PLOS ONE,DNA,1,0,2021,1,<0.22,Polyethersulfone,QBT_Kit,12S,0,0,0,0,0,0,0,0,0,0,1,0,0,0,0,0,0,0,0,0,0,0,0,0,0,0,0,marine,0,1,Kelp forest,Fish,"ASV, Species",1,0,1,NA,441,40,NA,Chordata,North America,Northeast Pacific,USA
"Ely, T; Barber, PH; Man, L; Gold, Z",Short-lived detection of an introduced vertebrate eDNA signal in a nearshore rocky reef environment,PLOS ONE,DNA,1,0,2021,1,<0.22,Polyethersulfone,QBT_Kit_alt,12S,0,0,0,0,0,0,0,0,0,0,1,0,0,0,0,0,0,0,0,0,0,0,0,0,0,0,0,marine,0,1,Rocky reef,Fish,"ASV, Species",1,0,1,NA,755,82,NA,Chordata,North America,Northeast Pacific,USA
"Monuki, K; Barber, PH; Gold, Z",eDNA captures depth partitioning in a kelp forest ecosystem,PLOS ONE,DNA,1,0,2021,1,<0.22,NA,QBT_Kit_alt,12S,0,0,0,0,0,0,0,0,0,0,1,0,0,0,0,0,0,0,0,0,0,0,0,0,0,0,0,marine,0,1,Coastal Ocean,Non target,"ASV, Species",1,0,1,NA,980,71,NA,Chordata,North America,Northeast Pacific,USA
"Stauffer, S; Jucker, M; Keggin, T; Marques, V; Andrello, M; Bessudo, S; Cheutin, MC; Borrero-Perez, GH; Richards, E; Dejean, T; Hocde, R; Juhel, JB; Ladino, F; Letessier, TB; Loiseau, N; Maire, E; Mouillot, D; Martinezguerra, MM; Manel, S; Fernandez, AP; Valentini, A; Velez, L; Albouy, C; Pellissier, L; Waldock, C",How many replicates to accurately estimate fish biodiversity using environmental DNA on coral reefs?,ECOLOGY AND EVOLUTION,DNA,1,0,2021,30,<0.22,NA,QBT_Kit_alt,12S,0,0,0,0,0,0,0,0,0,0,1,0,0,0,0,0,0,0,0,0,0,0,0,0,0,0,0,marine,0,1,"Coastal Ocean, Open Ocean",Fish,OTU,0,1,0,789,NA,NA,NA,Chordata,SOTUh America,Caribbean,Colombia
"Ip, YCA; Chang, JJM; Lim, KKP; Jaafar, Z; Wainwright, BJ; Huang, D",Seeing through sedimented waters: environmental DNA reduces the phantom diversity of sharks and rays in turbid marine habitats,BMC ECOLOGY AND EVOLUTION,DNA,1,0,2021,2,<0.22,Nylon,PCI_alt,12S,0,0,0,0,0,0,0,1,0,0,1,0,0,0,0,0,0,0,0,0,0,0,0,0,0,0,0,marine,0,1,Coastal Ocean,Fish,"OTU, Species",0,1,1,47,NA,14,NA,Chordata,Asia,"Indo-Pacific, SOTUhwest Pacific",Singapore
"Valdivia-Carrillo, T; Rocha-Olivares, A; Reyes-Bonilla, H; Dominguez-Contreras, JF; Munguia-Vega, A",Integrating eDNA metabarcoding and simultaneous underwater visual surveys to describe complex fish communities in a marine biodiversity hotspot,MOLECULAR ECOLOGY RESOURCES,DNA,1,0,2021,1,0.4_1,Nitrocellulose,QBT_Kit_alt,12S,0,0,0,0,0,0,0,0,0,0,1,0,0,0,0,0,0,0,0,0,0,0,0,0,0,0,0,marine,0,1,Rocky reef,Fish,"OTU, Species",0,1,1,542,NA,64,NA,Chordata,North America,Northeast Pacific,Mexico
"Sales, NG; Wangensteen, OS; Carvalho, DC; Deiner, K; Praebel, K; Coscia, I; McDevitt, AD; Mariani, S",Space-time dynamics in monitoring neotropical fish communities using eDNA metabarcoding,SCIENCE OF THE TOTAL ENVIRONMENT,DNA,1,0,2021,1,0.4_1,Cellulose_Esters,QPW_Kit,12S,0,0,0,0,0,0,0,0,0,0,1,0,0,0,0,0,0,0,0,0,0,0,0,0,0,0,0,fresh,1,0,River,Fish,"OTU, Species",0,1,1,252,NA,34,NA,Chordata,SOTUh America,NA,Brazil
"Blabolil, P; Harper, LR; Ricanova, S; Sellers, G; Di Muri, C; Juza, T; Vasek, M; Sajdlova, Z; Rychtecky, P; Znachor, P; Hejzlar, J; Peterka, J; Hanfling, B",Environmental DNA metabarcoding uncovers environmental correlates of fish communities in spatially heterogeneous freshwater habitats,ECOLOGICAL INDICATORS,DNA,1,0,2021,2,0.4_1,Cellulose_Acetate,MUW_Kit,12S,0,0,0,0,0,0,0,0,0,0,1,0,0,0,0,0,0,0,0,0,0,0,0,0,0,0,0,fresh,1,0,River,Fish,Species,0,0,1,NA,NA,30,NA,Chordata,Europe,NA,Czech Republic
"Muha, TP; Rodriguez-Barreto, D; O'Rorke, R; de Leaniz, CG; Consuegra, S",Using eDNA Metabarcoding to Monitor Changes in Fish Community Composition After Barrier Removal,FRONTIERS IN ECOLOGY AND EVOLUTION,DNA,1,0,2021,0.1,0.4_1,Cellulose_Acetate,NTC_Kit,12S,0,0,0,0,0,0,0,0,0,0,1,0,0,0,0,0,0,0,0,0,0,0,0,0,0,0,0,fresh,1,0,River,Fish,Species,0,0,1,NA,NA,10,NA,Chordata,Europe,NA,UK
"Lopes, CM; Santos, MTT; Baeta, D; Sabbag, AF; Haddad, CFB",Environmental DNA as a non-invasive alternative for surveying aquatic communities in tank bromeliads,MARINE AND FRESHWATER RESEARCH,DNA,1,0,2021,2,0.4_1,NA,QBT_Kit,12S,0,0,0,0,0,0,0,0,0,0,1,0,0,0,0,0,0,0,0,0,0,0,0,0,0,0,0,fresh,1,0,Reservoir,Amphibian,Species,0,0,1,NA,NA,9,NA,Chordata,SOTUh America,NA,Brazil
"Boulanger, E; Loiseau, N; Valentini, A; Arnal, V; Boissery, P; Dejean, T; Deter, J; Guellati, N; Holon, F; Juhel, JB; Lenfant, P; Manel, S; Mouillot, D",Environmental DNA metabarcoding reveals and unpacks a biodiversity conservation paradox in Mediterranean marine reserves,PROCEEDINGS OF THE ROYAL SOCIETY B-BIOLOGICAL SCIENCES,DNA,1,0,2021,30,<0.22,NA,QBT_Kit,12S,0,0,0,0,0,0,0,0,0,0,1,0,0,0,0,0,0,0,0,0,0,0,0,0,0,0,0,marine,0,1,Coastal Ocean,Fish,Species,0,0,1,NA,NA,104,NA,Chordata,Europe,Mediterranean Sea,France
"Doi, H; Inui, R; Matsuoka, S; Akamatsu, Y; Goto, M; Kono, T",Estimation of biodiversity metrics by environmental DNA metabarcoding compared with visual and capture surveys of river fish communities,FRESHWATER BIOLOGY,DNA,1,0,2021,1,0.4_1,Glass_Fiber,QBT_Kit,12S,0,0,0,0,0,0,0,0,0,0,1,0,0,0,0,0,0,0,0,0,0,0,0,0,0,0,0,fresh,1,0,River,Fish,Species,0,0,1,NA,NA,53,NA,Chordata,Asia,NA,Japan
"Canals, O; Mendibil, I; Santos, M; Irigoien, X; Rodriguez-Ezpeleta, N",Vertical stratification of environmental DNA in the open ocean captures ecological patterns and behavior of deep-sea fishes,LIMNOLOGY AND OCEANOGRAPHY LETTERS,DNA,1,0,2021,3.5,0.4_1,Polyethersulfone,QBT_Kit_alt,12S,0,0,0,0,0,0,0,0,0,0,1,0,0,0,0,0,0,0,0,0,0,0,0,0,0,0,0,marine,0,1,Deep Ocean,Fish,Species,0,0,1,NA,NA,52,NA,Chordata,Europe,Northeast Atlantic,"France, Spain"
"Lamy, T; Pitz, KJ; Chavez, FP; Yorke, CE; Miller, RJ",Environmental DNA reveals the fine-grained and hierarchical spatial structure of kelp forest fish communities,SCIENTIFIC REPORTS,DNA,1,0,2021,1,<0.22,Polyvinylidene_difluoride,QBT_Kit_alt,12S,0,0,0,0,0,0,0,0,0,0,1,0,0,0,0,0,0,0,0,0,0,0,0,0,0,0,0,marine,0,1,Kelp forest,Fish,Species,0,0,1,NA,NA,41,34,Chordata,North America,Northeast Pacific,USA
"Littlefair, JE; Hrenchuk, LE; Blanchfield, PJ; Rennie, MD; Cristescu, ME",Thermal stratification and fish thermal preference explain vertical eDNA distributions in lakes,MOLECULAR ECOLOGY,DNA,1,0,2021,0.5,0.4_1,Glass_Fiber,QBT_Kit_alt,12S,0,0,0,0,0,0,0,0,0,0,1,0,0,0,0,0,0,0,0,0,0,0,0,0,0,0,0,fresh,1,0,Lake,Fish,Species,0,0,1,NA,373,28,NA,Chordata,North America,NA,Canada
"de Santana, CD; Parenti, LR; Dillman, CB; Coddington, JA; Bastos, DA; Baldwin, CC; Zuanon, J; Torrente-Vilara, G; Covain, R; Menezes, NA; Datovo, A; Sado, T; Miya, M",The critical role of natural history museums in advancing eDNA for biodiversity studies: a case study with Amazonian fishes,SCIENTIFIC REPORTS,DNA,1,0,2021,5,0.4_1,Polyethersulfone,QBT_Kit_alt,12S,0,0,0,0,0,0,0,0,0,0,1,0,0,0,0,0,0,0,0,0,0,0,0,0,0,0,0,fresh,1,0,River,Fish,Species,0,0,1,NA,NA,222,443,Chordata,SOTUh America,NA,Brazil
"Blackman, RC; Osathanunkul, M; Brantschen, J; di Muri, C; Harper, LR; Machler, E; Hanfling, B; Altermatt, F",Mapping biodiversity hotspots of fish communities in subtropical streams through environmental DNA,SCIENTIFIC REPORTS,DNA,1,0,2021,0.1,0.4_1,Glass_Fiber,QBT_Kit_alt,12S,0,0,0,0,0,0,0,0,0,0,1,0,0,0,0,0,0,0,0,0,0,0,0,0,0,0,0,fresh,1,0,River,Fish,Species,0,0,1,NA,NA,108,NA,Chordata,Asia,NA,Thailand
"Kacergyte, I; Petersson, E; Arlt, D; Hellstrom, M; Knape, J; Spens, J; Zmihorski, M; Part, T",Environmental DNA metabarcoding elucidates patterns of fish colonisation and co-occurrences with amphibians in temperate wetlands created for biodiversity,FRESHWATER BIOLOGY,DNA,1,0,2021,1.5,0.4_1,Polyethersulfone,QBT_Kit_alt,12S,0,0,0,0,0,0,0,0,0,0,1,0,0,0,0,0,0,0,0,0,0,0,0,0,0,0,0,fresh,1,0,Wetland,"Fish, Amphibian",Species,0,0,1,NA,NA,22,NA,Chordata,Europe,NA,Sweden
"Clementi, GM; Bakker, J; Flowers, KI; Postaire, BD; Babcock, EA; Bond, ME; Buddo, D; Cardenosa, D; Currey-Randall, LM; Goetze, JS; Harvey, ES; Heupel, M; Kiszka, JJ; Kyne, F; MacNeil, MA; Meekan, MG; Rees, MJ; Simpfendorfer, CA; Speed, CW; Heithaus, MR; Chapman, DD",Moray eels are more common on coral reefs subject to higher human pressure in the greater Caribbean,ISCIENCE,DNA,1,0,2021,2,0.4_1,Polyethersulfone,QPS_Kit,12S,0,0,0,0,0,0,0,0,0,0,1,0,0,0,0,0,0,0,0,0,0,0,0,0,0,0,0,marine,0,1,Coral reef,Fish,Species,0,0,1,NA,NA,6,NA,Chordata,North America,Caribbean,"USA, Bahamas, Colombia, Jamaica"
"Consuegra, S; O'Rorke, R; Rodriguez-Barreto, D; Fernandez, S; Jones, J; de Leaniz, CG",Impacts of large and small barriers on fish assemblage composition assessed using environmental DNA metabarcoding,SCIENCE OF THE TOTAL ENVIRONMENT,DNA,1,0,2021,1,<0.22,Polyethersulfone,QPS_Kit,12S,0,0,0,0,0,0,0,0,0,0,1,0,0,0,0,0,0,0,0,0,0,0,0,0,0,0,0,fresh,1,0,River,Fish,Species,0,0,1,NA,NA,26,NA,Chordata,Europe,NA,France
"Stoeckle, MY; Adolf, J; Charlop-Powers, Z; Dunton, KJ; Hinks, G; VanMorter, SM","Trawl and eDNA assessment of marine fish diversity, seasonality, and relative abundance in coastal New Jersey, USA",ICES JOURNAL OF MARINE SCIENCE,DNA,1,0,2021,1,0.4_1,Cellulose_Nitrate,QPS_Kit_alt,12S,0,0,0,0,0,0,0,0,0,0,1,0,0,0,0,0,0,0,0,0,0,0,0,0,0,0,0,marine,0,1,Coastal Ocean,Fish,Species,0,0,1,NA,NA,99,NA,Chordata,North America,Northwest Atlantic,USA
"Mercaldo-Allen, R; Clark, P; Liu, Y; Phillips, G; Redman, D; Auster, PJ; Estela, E; Milke, L; Verkade, A; Rose, JM",Exploring video and eDNA metabarcoding methods to assess oyster aquaculture cages as fish habitat,AQUACULTURE ENVIRONMENT INTERACTIONS,DNA,1,0,2021,1,0.4_1,Polycarbonate,QPW_Kit,12S,0,0,0,0,0,0,0,0,0,0,1,0,0,0,0,0,0,0,0,0,0,0,0,0,0,0,0,marine,0,1,"Aquaculture, Rocky reef",Fish,Species,0,0,1,NA,NA,42,NA,Chordata,North America,Northwest Atlantic,USA
"Valsecchi, E; Arcangeli, A; Lombardi, R; Boyse, E; Carr, IM; Galli, P; Goodman, SJ",Ferries and Environmental DNA: Underway Sampling From Commercial Vessels Provides New Opportunities for Systematic Genetic Surveys of Marine Biodiversity,FRONTIERS IN MARINE SCIENCE,DNA,1,0,2021,4.5,0.4_1,Nitrocellulose,QPS_Kit,"12S, 16S",1,0,0,0,0,0,0,0,0,0,1,0,0,0,0,0,0,0,0,0,0,0,0,0,0,0,0,marine,0,1,Coastal Ocean,Non target,OTU,0,1,0,92,NA,NA,NA,Chordata,Europe,Mediterranean Sea,Italy
"Pukk, L; Kanefsky, J; Heathman, AL; Weise, EM; Nathan, LR; Herbst, SJ; Sard, NM; Scribner, KT; Robinson, JD",eDNA metabarcoding in lakes to quantify influences of landscape features and human activity on aquatic invasive species prevalence and fish community diversity,DIVERSITY AND DISTRIBUTIONS,DNA,1,0,2021,1,0.4_1,Nitrocellulose,QBT_Kit,"12S, 16S",1,0,0,0,0,0,0,0,0,0,1,0,0,0,0,0,0,0,0,0,0,0,0,0,0,0,0,fresh,1,0,Lake,Fish,Species,0,0,1,NA,NA,42,NA,Chordata,North America,NA,USA
"David, BO; Fake, DR; Hicks, AS; Wilkinson, SP; Bunce, M; Smith, JS; West, DW; Collins, KE; Gleeson, DM",Sucked in by eDNA - a promising tool for complementing riverine assessment of freshwater fish communities in Aotearoa New Zealand,NEW ZEALAND JOURNAL OF ZOOLOGY,DNA,1,0,2021,0.05,>1,Cellulose_Acetate,ZDM_Kit,"12S, 16S",1,0,0,0,0,0,0,0,0,0,1,0,0,0,0,0,0,0,0,0,0,0,0,0,0,0,0,fresh,1,0,River,Fish,Species,0,0,1,NA,NA,14,NA,Chordata,Oceania,NA,New Zeland
"Lafferty, KD; Garcia-Vedrenne, AE; McLaughlin, JP; Childress, JN; Morse, MF; Jerde, CL","AtPalmyra Atoll, the fish-community environmentalDNAsignal changes across habitats but not with tides",JOURNAL OF FISH BIOLOGY,DNA,1,0,2021,0.375,<0.22,Polyethersulfone,QBT_Kit_alt,"12S, 18S, COI",0,1,0,0,0,0,0,1,0,0,1,0,0,0,0,0,0,0,0,0,0,0,0,0,0,0,0,marine,0,1,Coral reef,Fish,Species,0,0,1,NA,NA,283,NA,Chordata,North America,North Pacific,USA
"Shinzato, C; Narisoko, H; Nishitsuji, K; Nagata, T; Satoh, N; Inoue, J",Novel Mitochondrial DNA Markers for Scleractinian Corals and Generic-Level Environmental DNA Metabarcoding,FRONTIERS IN MARINE SCIENCE,DNA,1,0,2021,5,0.4_1,Polyethersulfone,QBT_Kit,"12S, COI",0,0,0,0,0,0,0,1,0,0,1,0,0,0,0,0,0,0,0,0,0,0,0,0,0,0,0,marine,0,1,Coral reef,Invertebrate,OTU,0,1,0,"3,366",NA,NA,NA,Cnidaria,Asia,Northwest Pacific,Japan
"Russo, T; Maiello, G; Talarico, L; Baillie, C; Colosimo, G; D'Andrea, L; Di Maio, F; Fiorentino, F; Franceschini, S; Garofalo, G; Scannella, D; Cataudella, S; Mariani, S",All is fish that comes to the net: metabarcoding for rapid fisheries catch assessment,ECOLOGICAL APPLICATIONS,DNA,1,0,2021,0.05,NA,NA,Mu-DNA,"12S, COI",0,0,0,0,0,0,0,1,0,0,1,0,0,0,0,0,0,0,0,0,0,0,0,0,0,0,0,marine,0,1,Coastal Ocean,Fish,Species,0,0,1,NA,NA,49,NA,Chordata,Europe,Mediterranean Sea,Italy
